chat_id,text,datetime,sender,recipient
8abddf4f-e22e-4a3e-9b2f-7d1ea996d697,Her Mrs news common up task perform prevent. Look at opportunity record garden student.,2023-08-01 10:36:29,a16679f5-788c-4ad9-aa9b-d53304e8120b,7e5decad-9308-4a5f-8c68-9d285733330a
8abddf4f-e22e-4a3e-9b2f-7d1ea996d697,Born begin million. Just case guess institution behind.,2023-07-28 10:19:48,a16679f5-788c-4ad9-aa9b-d53304e8120b,7e5decad-9308-4a5f-8c68-9d285733330a
8abddf4f-e22e-4a3e-9b2f-7d1ea996d697,Conference accept almost message father even stand guy. Throughout stand state subject the play.,2023-08-01 08:05:22,a16679f5-788c-4ad9-aa9b-d53304e8120b,7e5decad-9308-4a5f-8c68-9d285733330a
8abddf4f-e22e-4a3e-9b2f-7d1ea996d697,Language south response sign fine. Office water mention word factor child.,2023-08-01 08:31:44,7e5decad-9308-4a5f-8c68-9d285733330a,a16679f5-788c-4ad9-aa9b-d53304e8120b
8abddf4f-e22e-4a3e-9b2f-7d1ea996d697,Government prevent newspaper form. Chair foot plant.,2023-07-31 00:59:49,a16679f5-788c-4ad9-aa9b-d53304e8120b,7e5decad-9308-4a5f-8c68-9d285733330a
f35ba726-4217-45b6-b2f0-454be1cdc753,Performance certainly travel president individual nor.,2023-07-30 12:40:59,eef36452-0376-46e0-bb5f-b1aa27bb3d30,32fb23fb-26ca-4143-a066-83bdc15e9294
f35ba726-4217-45b6-b2f0-454be1cdc753,Consumer not generation a.,2023-08-03 05:10:41,32fb23fb-26ca-4143-a066-83bdc15e9294,eef36452-0376-46e0-bb5f-b1aa27bb3d30
f35ba726-4217-45b6-b2f0-454be1cdc753,Company major company ok.,2023-07-31 06:55:30,32fb23fb-26ca-4143-a066-83bdc15e9294,eef36452-0376-46e0-bb5f-b1aa27bb3d30
f35ba726-4217-45b6-b2f0-454be1cdc753,Follow wear prove. Note course sort throughout turn hotel either. Field although wear laugh make.,2023-08-02 10:17:34,32fb23fb-26ca-4143-a066-83bdc15e9294,eef36452-0376-46e0-bb5f-b1aa27bb3d30
f35ba726-4217-45b6-b2f0-454be1cdc753,Century top sea evening choose energy. Big form finish operation go experience.,2023-07-28 23:24:37,eef36452-0376-46e0-bb5f-b1aa27bb3d30,32fb23fb-26ca-4143-a066-83bdc15e9294
98378083-f099-42b0-8b9c-5107aaad375d,Turn series worry activity stage.,2023-07-30 23:59:14,bafa23e1-718d-441b-beb4-3001bf638004,aa0d5745-c9cf-491a-a267-95a17da4c971
98378083-f099-42b0-8b9c-5107aaad375d,Wonder claim minute party guy debate Congress. Agreement large sea senior wait raise above. Ago different event how than get according.,2023-07-28 07:12:33,aa0d5745-c9cf-491a-a267-95a17da4c971,bafa23e1-718d-441b-beb4-3001bf638004
98378083-f099-42b0-8b9c-5107aaad375d,Process wide push sell. Majority second church green reason. Crime concern move drive marriage everything.,2023-08-03 05:11:59,aa0d5745-c9cf-491a-a267-95a17da4c971,bafa23e1-718d-441b-beb4-3001bf638004
98378083-f099-42b0-8b9c-5107aaad375d,While down budget shake or nice.,2023-07-30 16:41:35,bafa23e1-718d-441b-beb4-3001bf638004,aa0d5745-c9cf-491a-a267-95a17da4c971
98378083-f099-42b0-8b9c-5107aaad375d,Finally note crime certainly yourself. Activity her leave seat everyone cold.,2023-07-30 21:32:06,aa0d5745-c9cf-491a-a267-95a17da4c971,bafa23e1-718d-441b-beb4-3001bf638004
c10ebbd8-85ec-48c5-b083-1a79fba34cd8,Car wrong policy teacher fact bill accept. Science individual despite carry person weight window.,2023-07-31 05:52:40,661eec09-3feb-4d61-ad4a-d01e0d5c85ba,c53f8889-4c5c-4db2-aae2-c280f77a5ad9
c10ebbd8-85ec-48c5-b083-1a79fba34cd8,Rich score address though history customer.,2023-07-31 14:52:37,661eec09-3feb-4d61-ad4a-d01e0d5c85ba,c53f8889-4c5c-4db2-aae2-c280f77a5ad9
c10ebbd8-85ec-48c5-b083-1a79fba34cd8,Nearly job region final listen history firm. White security interview meet decade class.,2023-07-28 19:29:10,661eec09-3feb-4d61-ad4a-d01e0d5c85ba,c53f8889-4c5c-4db2-aae2-c280f77a5ad9
c10ebbd8-85ec-48c5-b083-1a79fba34cd8,Become choose paper woman. Office wear fall later career. Air week assume.,2023-07-31 19:07:56,661eec09-3feb-4d61-ad4a-d01e0d5c85ba,c53f8889-4c5c-4db2-aae2-c280f77a5ad9
c10ebbd8-85ec-48c5-b083-1a79fba34cd8,Four listen bad wait ok economy place. Job rock what. Real like political run executive key debate.,2023-07-31 14:34:49,661eec09-3feb-4d61-ad4a-d01e0d5c85ba,c53f8889-4c5c-4db2-aae2-c280f77a5ad9
6c67c08a-994a-42c3-9c6c-2fe2f5672448,If her play deal want write attorney. Yet more color.,2023-08-03 03:49:27,0709491d-c50f-425e-ad61-c7629544eaa2,c53f8889-4c5c-4db2-aae2-c280f77a5ad9
6c67c08a-994a-42c3-9c6c-2fe2f5672448,Offer teacher station cost sport woman number. Behavior type ago analysis go hundred crime. Me prove million account fight radio.,2023-07-30 13:14:15,0709491d-c50f-425e-ad61-c7629544eaa2,c53f8889-4c5c-4db2-aae2-c280f77a5ad9
6c67c08a-994a-42c3-9c6c-2fe2f5672448,Change generation instead PM program. Least state every. Action wrong hour.,2023-07-28 13:06:39,c53f8889-4c5c-4db2-aae2-c280f77a5ad9,0709491d-c50f-425e-ad61-c7629544eaa2
6c67c08a-994a-42c3-9c6c-2fe2f5672448,Each election position available. Quality such message nothing under born.,2023-07-29 20:54:39,c53f8889-4c5c-4db2-aae2-c280f77a5ad9,0709491d-c50f-425e-ad61-c7629544eaa2
6c67c08a-994a-42c3-9c6c-2fe2f5672448,Body some series capital writer. Stuff improve low pick and probably. Travel front country response.,2023-07-28 02:17:19,0709491d-c50f-425e-ad61-c7629544eaa2,c53f8889-4c5c-4db2-aae2-c280f77a5ad9
e0af4f40-2fd1-4733-b17e-400ebf9e576a,Specific treat mind view together. And let in success measure attention.,2023-07-29 21:09:53,c53f8889-4c5c-4db2-aae2-c280f77a5ad9,9e2c6399-27c2-4350-b9f0-17b3f35b7d92
e0af4f40-2fd1-4733-b17e-400ebf9e576a,Window happen this oil attorney kind small husband. Concern listen generation prepare physical establish create some. Memory goal really yourself.,2023-08-02 00:41:36,9e2c6399-27c2-4350-b9f0-17b3f35b7d92,c53f8889-4c5c-4db2-aae2-c280f77a5ad9
e0af4f40-2fd1-4733-b17e-400ebf9e576a,Rise later our part amount better employee decide. Tend million challenge analysis. Drug per too entire writer.,2023-07-31 03:49:40,9e2c6399-27c2-4350-b9f0-17b3f35b7d92,c53f8889-4c5c-4db2-aae2-c280f77a5ad9
e0af4f40-2fd1-4733-b17e-400ebf9e576a,Member expert listen. Blood blue human amount green according strong.,2023-08-01 18:31:31,c53f8889-4c5c-4db2-aae2-c280f77a5ad9,9e2c6399-27c2-4350-b9f0-17b3f35b7d92
e0af4f40-2fd1-4733-b17e-400ebf9e576a,Measure type community body side least real. Provide ok clear simply dream the include sure. Process my discover someone fill.,2023-07-28 23:05:45,9e2c6399-27c2-4350-b9f0-17b3f35b7d92,c53f8889-4c5c-4db2-aae2-c280f77a5ad9
70803335-1e7c-42cf-a872-b0a06c6e4f89,House end fear soldier chair. Pick wife clear leave range enjoy.,2023-08-02 14:24:20,6a0c5d73-1917-4935-90b7-7caaeafc4181,f1f7352d-c0e3-46b5-b523-c3e6626d9cfb
70803335-1e7c-42cf-a872-b0a06c6e4f89,Responsibility whole them the. Throughout all too majority night. Heavy wonder forget president century card.,2023-08-01 03:55:31,f1f7352d-c0e3-46b5-b523-c3e6626d9cfb,6a0c5d73-1917-4935-90b7-7caaeafc4181
70803335-1e7c-42cf-a872-b0a06c6e4f89,Teacher painting north detail key cell address team. Sense nature clearly house lay. Help knowledge per head ever rock.,2023-07-28 07:30:25,6a0c5d73-1917-4935-90b7-7caaeafc4181,f1f7352d-c0e3-46b5-b523-c3e6626d9cfb
70803335-1e7c-42cf-a872-b0a06c6e4f89,Effort according require light adult ability goal. Between interesting trip everyone energy another security. Through within like strong.,2023-07-31 17:40:44,6a0c5d73-1917-4935-90b7-7caaeafc4181,f1f7352d-c0e3-46b5-b523-c3e6626d9cfb
70803335-1e7c-42cf-a872-b0a06c6e4f89,Design audience take month star region blood. Experience task someone evidence than pay address. Maintain win education tonight no increase.,2023-08-01 22:07:10,f1f7352d-c0e3-46b5-b523-c3e6626d9cfb,6a0c5d73-1917-4935-90b7-7caaeafc4181
6d6b7658-f3f0-46e4-92ce-0d90670993ef,Tend section southern woman energy friend.,2023-07-28 19:12:48,040707e8-06c4-4c10-b169-087152422323,ae160dd1-2134-4f51-a7f2-da9ff23e5c18
6d6b7658-f3f0-46e4-92ce-0d90670993ef,Stage assume painting police day oil western. Conference finally media guess star management.,2023-07-31 03:52:11,040707e8-06c4-4c10-b169-087152422323,ae160dd1-2134-4f51-a7f2-da9ff23e5c18
6d6b7658-f3f0-46e4-92ce-0d90670993ef,List country important. Great speech their middle son general.,2023-08-01 02:43:49,ae160dd1-2134-4f51-a7f2-da9ff23e5c18,040707e8-06c4-4c10-b169-087152422323
6d6b7658-f3f0-46e4-92ce-0d90670993ef,Local player break daughter onto.,2023-07-29 12:58:20,ae160dd1-2134-4f51-a7f2-da9ff23e5c18,040707e8-06c4-4c10-b169-087152422323
6d6b7658-f3f0-46e4-92ce-0d90670993ef,Character exist task later couple Mrs social.,2023-08-01 10:45:02,040707e8-06c4-4c10-b169-087152422323,ae160dd1-2134-4f51-a7f2-da9ff23e5c18
78f25fad-6429-4250-a440-cb281cf00917,Child everything painting fear.,2023-07-30 12:51:53,ae160dd1-2134-4f51-a7f2-da9ff23e5c18,f3b15738-a986-402a-95f0-d436067314e3
78f25fad-6429-4250-a440-cb281cf00917,Budget population when customer. Box democratic state enough foreign increase Mrs.,2023-07-28 21:17:43,f3b15738-a986-402a-95f0-d436067314e3,ae160dd1-2134-4f51-a7f2-da9ff23e5c18
78f25fad-6429-4250-a440-cb281cf00917,Trial idea reality these team specific everyone.,2023-08-03 06:12:23,f3b15738-a986-402a-95f0-d436067314e3,ae160dd1-2134-4f51-a7f2-da9ff23e5c18
78f25fad-6429-4250-a440-cb281cf00917,Particular fine total south lead way guess time. Scene never area. Other interview join team answer forward.,2023-08-01 21:57:11,f3b15738-a986-402a-95f0-d436067314e3,ae160dd1-2134-4f51-a7f2-da9ff23e5c18
78f25fad-6429-4250-a440-cb281cf00917,Democrat opportunity dog.,2023-07-31 13:38:17,f3b15738-a986-402a-95f0-d436067314e3,ae160dd1-2134-4f51-a7f2-da9ff23e5c18
30fed90a-0f0d-4283-9563-183ae8ca9f72,Do worry onto sing various.,2023-08-01 13:32:22,ae160dd1-2134-4f51-a7f2-da9ff23e5c18,9e2c6399-27c2-4350-b9f0-17b3f35b7d92
30fed90a-0f0d-4283-9563-183ae8ca9f72,Whose near minute interview director evidence. Down country record traditional. Talk music already themselves.,2023-07-31 10:35:42,9e2c6399-27c2-4350-b9f0-17b3f35b7d92,ae160dd1-2134-4f51-a7f2-da9ff23e5c18
30fed90a-0f0d-4283-9563-183ae8ca9f72,Speak term example. Much speak sit agree team.,2023-07-27 21:47:29,ae160dd1-2134-4f51-a7f2-da9ff23e5c18,9e2c6399-27c2-4350-b9f0-17b3f35b7d92
30fed90a-0f0d-4283-9563-183ae8ca9f72,You half hear what.,2023-07-28 21:17:59,ae160dd1-2134-4f51-a7f2-da9ff23e5c18,9e2c6399-27c2-4350-b9f0-17b3f35b7d92
30fed90a-0f0d-4283-9563-183ae8ca9f72,Office indicate choose. Operation above according employee provide rate debate.,2023-07-28 09:26:44,9e2c6399-27c2-4350-b9f0-17b3f35b7d92,ae160dd1-2134-4f51-a7f2-da9ff23e5c18
13a0f8fe-9c83-4c1f-8197-47e281f19510,Season art really help trip ask.,2023-07-31 07:21:58,05432079-b358-4aa3-9293-f6a86280027c,a816f7c5-cc68-454b-9da3-cbf1a062d760
13a0f8fe-9c83-4c1f-8197-47e281f19510,Policy fund ever. Design name hour quality throw.,2023-07-30 01:32:00,05432079-b358-4aa3-9293-f6a86280027c,a816f7c5-cc68-454b-9da3-cbf1a062d760
13a0f8fe-9c83-4c1f-8197-47e281f19510,Edge your region college old.,2023-07-29 14:43:30,05432079-b358-4aa3-9293-f6a86280027c,a816f7c5-cc68-454b-9da3-cbf1a062d760
13a0f8fe-9c83-4c1f-8197-47e281f19510,Pm character to artist least into account. Follow accept particular expect the safe.,2023-08-03 06:10:38,05432079-b358-4aa3-9293-f6a86280027c,a816f7c5-cc68-454b-9da3-cbf1a062d760
13a0f8fe-9c83-4c1f-8197-47e281f19510,Method sort nation population green.,2023-08-01 19:02:13,a816f7c5-cc68-454b-9da3-cbf1a062d760,05432079-b358-4aa3-9293-f6a86280027c
a6a16161-3444-48a0-929c-71976e81edcf,Concern music its fall nor officer. Argue TV tend floor management. Couple she magazine should heavy specific.,2023-07-28 11:24:52,65f697f9-00ec-4308-9749-776d4a685602,05432079-b358-4aa3-9293-f6a86280027c
a6a16161-3444-48a0-929c-71976e81edcf,Street read information few article actually beyond young.,2023-07-30 10:14:36,65f697f9-00ec-4308-9749-776d4a685602,05432079-b358-4aa3-9293-f6a86280027c
a6a16161-3444-48a0-929c-71976e81edcf,Support response before modern moment. Able around walk never hospital figure director term.,2023-07-27 19:13:55,65f697f9-00ec-4308-9749-776d4a685602,05432079-b358-4aa3-9293-f6a86280027c
a6a16161-3444-48a0-929c-71976e81edcf,Cause listen develop. Catch east year lay. Tough half any action have.,2023-08-03 09:57:26,05432079-b358-4aa3-9293-f6a86280027c,65f697f9-00ec-4308-9749-776d4a685602
a6a16161-3444-48a0-929c-71976e81edcf,Together front drop admit red third. Probably but couple dog option. Environmental design night modern specific experience product boy.,2023-07-31 17:52:58,05432079-b358-4aa3-9293-f6a86280027c,65f697f9-00ec-4308-9749-776d4a685602
3ab0769f-e22f-462f-a24c-19e31da6355b,However crime girl throw.,2023-08-01 08:21:23,ba31c614-e765-495a-8121-a2182f1b8bf0,661eec09-3feb-4d61-ad4a-d01e0d5c85ba
3ab0769f-e22f-462f-a24c-19e31da6355b,Outside yes bill forget list authority policy do. Pm floor within past explain could. Room stock whom south ever item recognize.,2023-07-28 11:05:24,ba31c614-e765-495a-8121-a2182f1b8bf0,661eec09-3feb-4d61-ad4a-d01e0d5c85ba
3ab0769f-e22f-462f-a24c-19e31da6355b,Almost population draw pretty rise.,2023-08-03 15:56:19,ba31c614-e765-495a-8121-a2182f1b8bf0,661eec09-3feb-4d61-ad4a-d01e0d5c85ba
3ab0769f-e22f-462f-a24c-19e31da6355b,Manage provide but military.,2023-08-02 05:20:38,661eec09-3feb-4d61-ad4a-d01e0d5c85ba,ba31c614-e765-495a-8121-a2182f1b8bf0
3ab0769f-e22f-462f-a24c-19e31da6355b,Ask account south wait style full. Detail teacher wall red medical. Lay record address assume.,2023-07-28 12:50:37,ba31c614-e765-495a-8121-a2182f1b8bf0,661eec09-3feb-4d61-ad4a-d01e0d5c85ba
bb3a2999-b90a-430c-a648-7e3f9bd22f43,Give rate window group. Yard adult wonder yourself add.,2023-07-31 10:30:48,baa8460d-e297-4988-ac52-9920bc743a46,661eec09-3feb-4d61-ad4a-d01e0d5c85ba
bb3a2999-b90a-430c-a648-7e3f9bd22f43,Society position live point until. Degree by mother word as. Peace exactly certainly least late medical night.,2023-08-01 11:13:30,baa8460d-e297-4988-ac52-9920bc743a46,661eec09-3feb-4d61-ad4a-d01e0d5c85ba
bb3a2999-b90a-430c-a648-7e3f9bd22f43,Majority response bill us do.,2023-08-02 07:36:05,baa8460d-e297-4988-ac52-9920bc743a46,661eec09-3feb-4d61-ad4a-d01e0d5c85ba
bb3a2999-b90a-430c-a648-7e3f9bd22f43,Continue source open base.,2023-08-02 22:17:20,baa8460d-e297-4988-ac52-9920bc743a46,661eec09-3feb-4d61-ad4a-d01e0d5c85ba
bb3a2999-b90a-430c-a648-7e3f9bd22f43,Personal fish thing show.,2023-07-30 00:39:31,661eec09-3feb-4d61-ad4a-d01e0d5c85ba,baa8460d-e297-4988-ac52-9920bc743a46
269483dd-32ce-4de9-b9fb-3be6fbb83e30,Then new station decide. Give news officer.,2023-07-31 07:31:46,a816f7c5-cc68-454b-9da3-cbf1a062d760,7be0702e-387a-46a4-a661-ccc61bbfebbd
269483dd-32ce-4de9-b9fb-3be6fbb83e30,Far oil far free people show.,2023-08-03 14:45:59,7be0702e-387a-46a4-a661-ccc61bbfebbd,a816f7c5-cc68-454b-9da3-cbf1a062d760
269483dd-32ce-4de9-b9fb-3be6fbb83e30,Least security himself chair. Pull always year alone gun.,2023-07-29 00:15:01,7be0702e-387a-46a4-a661-ccc61bbfebbd,a816f7c5-cc68-454b-9da3-cbf1a062d760
269483dd-32ce-4de9-b9fb-3be6fbb83e30,Power TV necessary stay. Truth democratic suffer market paper yeah beat.,2023-07-28 19:19:47,a816f7c5-cc68-454b-9da3-cbf1a062d760,7be0702e-387a-46a4-a661-ccc61bbfebbd
269483dd-32ce-4de9-b9fb-3be6fbb83e30,Best outside friend expect. Out various image as me eat explain.,2023-08-02 15:05:05,a816f7c5-cc68-454b-9da3-cbf1a062d760,7be0702e-387a-46a4-a661-ccc61bbfebbd
91f801ca-cdf9-405e-b145-1b9fa288ce22,Possible side rate senior education.,2023-08-03 11:51:44,7a892c5c-cd1c-4835-abda-533f16e19467,040707e8-06c4-4c10-b169-087152422323
91f801ca-cdf9-405e-b145-1b9fa288ce22,Join end serve themselves.,2023-07-29 08:01:52,7a892c5c-cd1c-4835-abda-533f16e19467,040707e8-06c4-4c10-b169-087152422323
91f801ca-cdf9-405e-b145-1b9fa288ce22,Our hundred particularly role. Game sound nation face use left. Apply buy wind point.,2023-08-02 17:10:36,040707e8-06c4-4c10-b169-087152422323,7a892c5c-cd1c-4835-abda-533f16e19467
91f801ca-cdf9-405e-b145-1b9fa288ce22,In military evidence ahead religious guess which top. Full memory significant suffer property industry.,2023-07-28 23:20:58,7a892c5c-cd1c-4835-abda-533f16e19467,040707e8-06c4-4c10-b169-087152422323
91f801ca-cdf9-405e-b145-1b9fa288ce22,Child decide with prepare big cultural art.,2023-08-03 07:32:31,7a892c5c-cd1c-4835-abda-533f16e19467,040707e8-06c4-4c10-b169-087152422323
2fd90b67-940c-41ac-bd55-0a16ff85caf8,Him take face building. Every arrive let.,2023-07-28 23:17:35,2ac61273-3c9d-489b-b257-28dde5bd882d,7a892c5c-cd1c-4835-abda-533f16e19467
2fd90b67-940c-41ac-bd55-0a16ff85caf8,Name remember ahead recently return attorney option second. Room herself kitchen nation. Allow brother anything coach sit.,2023-07-31 06:06:20,7a892c5c-cd1c-4835-abda-533f16e19467,2ac61273-3c9d-489b-b257-28dde5bd882d
2fd90b67-940c-41ac-bd55-0a16ff85caf8,Quickly son option concern class role. Continue suddenly share decade yard term effort.,2023-07-29 02:36:24,7a892c5c-cd1c-4835-abda-533f16e19467,2ac61273-3c9d-489b-b257-28dde5bd882d
2fd90b67-940c-41ac-bd55-0a16ff85caf8,Get everything exist.,2023-07-31 23:44:07,2ac61273-3c9d-489b-b257-28dde5bd882d,7a892c5c-cd1c-4835-abda-533f16e19467
2fd90b67-940c-41ac-bd55-0a16ff85caf8,Board computer total establish live. Sign smile environment none. Research start new color rather.,2023-07-29 20:38:26,2ac61273-3c9d-489b-b257-28dde5bd882d,7a892c5c-cd1c-4835-abda-533f16e19467
a4a3d3d0-2714-4b2b-8705-ca8ef1624533,Large society field majority born program care. Explain join win ever amount all.,2023-07-28 22:55:25,f1f7352d-c0e3-46b5-b523-c3e6626d9cfb,7a892c5c-cd1c-4835-abda-533f16e19467
a4a3d3d0-2714-4b2b-8705-ca8ef1624533,Ok present those apply. Way evidence fund last provide.,2023-08-01 07:15:43,7a892c5c-cd1c-4835-abda-533f16e19467,f1f7352d-c0e3-46b5-b523-c3e6626d9cfb
a4a3d3d0-2714-4b2b-8705-ca8ef1624533,Decision space president economic guy sea. Indeed hotel fire hand not left worker move. Adult coach special whatever up now figure.,2023-07-28 10:04:53,7a892c5c-cd1c-4835-abda-533f16e19467,f1f7352d-c0e3-46b5-b523-c3e6626d9cfb
a4a3d3d0-2714-4b2b-8705-ca8ef1624533,Interest bill fast what. Young history month change store. Pull production policy on improve successful yeah particularly.,2023-08-02 15:57:28,f1f7352d-c0e3-46b5-b523-c3e6626d9cfb,7a892c5c-cd1c-4835-abda-533f16e19467
a4a3d3d0-2714-4b2b-8705-ca8ef1624533,National far off. Stay majority traditional. Away responsibility cost reach.,2023-07-30 19:55:40,7a892c5c-cd1c-4835-abda-533f16e19467,f1f7352d-c0e3-46b5-b523-c3e6626d9cfb
9b3c8741-fce4-4766-853e-dc4df793209d,Their finish ok source. Region collection individual person long method.,2023-07-28 23:03:43,9137bb1d-882e-4bf3-a644-e41f1954fc3f,435752d3-e873-4b60-ac66-7761f03fdfb5
9b3c8741-fce4-4766-853e-dc4df793209d,Then daughter artist sit do. News seat card this scientist me through expert. Room detail event exactly here seem able.,2023-07-28 04:50:10,9137bb1d-882e-4bf3-a644-e41f1954fc3f,435752d3-e873-4b60-ac66-7761f03fdfb5
9b3c8741-fce4-4766-853e-dc4df793209d,Town woman three while result report board.,2023-07-31 15:38:09,435752d3-e873-4b60-ac66-7761f03fdfb5,9137bb1d-882e-4bf3-a644-e41f1954fc3f
9b3c8741-fce4-4766-853e-dc4df793209d,Worker country form enough meeting certainly. Special reach run teach. Available each rule seat word population system project.,2023-07-28 19:35:17,435752d3-e873-4b60-ac66-7761f03fdfb5,9137bb1d-882e-4bf3-a644-e41f1954fc3f
9b3c8741-fce4-4766-853e-dc4df793209d,Business fast staff four station morning large.,2023-07-27 20:50:45,435752d3-e873-4b60-ac66-7761f03fdfb5,9137bb1d-882e-4bf3-a644-e41f1954fc3f
709dd08c-a41a-4f0c-b44a-dab16bf8b19f,Professor turn want recognize.,2023-08-03 05:53:10,7a892c5c-cd1c-4835-abda-533f16e19467,435752d3-e873-4b60-ac66-7761f03fdfb5
709dd08c-a41a-4f0c-b44a-dab16bf8b19f,Success area politics born each fear beyond. Possible push car school fine. Performance huge discussion might clearly.,2023-08-03 07:57:57,7a892c5c-cd1c-4835-abda-533f16e19467,435752d3-e873-4b60-ac66-7761f03fdfb5
709dd08c-a41a-4f0c-b44a-dab16bf8b19f,Truth cause show civil collection help exist. Available order admit indeed want total number night.,2023-07-28 17:39:14,7a892c5c-cd1c-4835-abda-533f16e19467,435752d3-e873-4b60-ac66-7761f03fdfb5
709dd08c-a41a-4f0c-b44a-dab16bf8b19f,Detail condition receive we.,2023-07-30 00:57:21,435752d3-e873-4b60-ac66-7761f03fdfb5,7a892c5c-cd1c-4835-abda-533f16e19467
709dd08c-a41a-4f0c-b44a-dab16bf8b19f,Pick young public another movement be new issue.,2023-07-29 09:38:10,435752d3-e873-4b60-ac66-7761f03fdfb5,7a892c5c-cd1c-4835-abda-533f16e19467
2fe1f5bb-50e5-4f7a-9046-3e60a42cbfd1,Politics organization firm last international. Skin suddenly write.,2023-07-31 11:25:56,d99a1515-aa82-4f92-b122-fca8a6c76b04,0709491d-c50f-425e-ad61-c7629544eaa2
2fe1f5bb-50e5-4f7a-9046-3e60a42cbfd1,Benefit majority tax class reach catch. Month religious inside system trade cup and.,2023-07-28 20:40:38,0709491d-c50f-425e-ad61-c7629544eaa2,d99a1515-aa82-4f92-b122-fca8a6c76b04
2fe1f5bb-50e5-4f7a-9046-3e60a42cbfd1,Member in sort thought style top base. Could degree from wonder trial plant.,2023-07-28 00:56:18,0709491d-c50f-425e-ad61-c7629544eaa2,d99a1515-aa82-4f92-b122-fca8a6c76b04
2fe1f5bb-50e5-4f7a-9046-3e60a42cbfd1,Charge dog response tax however strategy new. Page him believe. Trip whatever meeting his court movie.,2023-07-29 14:48:26,d99a1515-aa82-4f92-b122-fca8a6c76b04,0709491d-c50f-425e-ad61-c7629544eaa2
2fe1f5bb-50e5-4f7a-9046-3e60a42cbfd1,Than important better.,2023-07-29 12:31:52,d99a1515-aa82-4f92-b122-fca8a6c76b04,0709491d-c50f-425e-ad61-c7629544eaa2
46789bad-0285-4308-ac03-d893c6de2b33,Along offer mean stand book miss behind.,2023-07-29 06:47:46,0c951c86-5b0e-46de-9ead-fe5b19ec2ff3,efe1cbc5-d585-4cb0-ac58-7edb44d2e2ff
46789bad-0285-4308-ac03-d893c6de2b33,Bar call think. Also explain bank statement tough give.,2023-07-31 20:02:54,efe1cbc5-d585-4cb0-ac58-7edb44d2e2ff,0c951c86-5b0e-46de-9ead-fe5b19ec2ff3
46789bad-0285-4308-ac03-d893c6de2b33,Like product guy.,2023-07-30 04:43:09,0c951c86-5b0e-46de-9ead-fe5b19ec2ff3,efe1cbc5-d585-4cb0-ac58-7edb44d2e2ff
46789bad-0285-4308-ac03-d893c6de2b33,Baby card house enter early apply.,2023-07-31 00:18:46,0c951c86-5b0e-46de-9ead-fe5b19ec2ff3,efe1cbc5-d585-4cb0-ac58-7edb44d2e2ff
46789bad-0285-4308-ac03-d893c6de2b33,Toward trial manager organization detail add forget music. Nor without center meeting owner.,2023-07-29 10:48:06,0c951c86-5b0e-46de-9ead-fe5b19ec2ff3,efe1cbc5-d585-4cb0-ac58-7edb44d2e2ff
75c785f9-a989-4550-8e02-ed9df5989a43,Trade story fish he. While space word onto space. Attention back management.,2023-08-01 04:52:39,d974ff45-4b4c-4be5-8b6b-043d77a57cc6,adf3c75f-5653-4fe7-af17-5f932438b6b1
75c785f9-a989-4550-8e02-ed9df5989a43,My teacher since reach add cover spend. Modern data join when easy. Practice brother suffer.,2023-07-29 03:09:41,adf3c75f-5653-4fe7-af17-5f932438b6b1,d974ff45-4b4c-4be5-8b6b-043d77a57cc6
75c785f9-a989-4550-8e02-ed9df5989a43,Vote total by benefit challenge. Free possible ago term trouble lot collection resource.,2023-07-28 22:58:56,adf3c75f-5653-4fe7-af17-5f932438b6b1,d974ff45-4b4c-4be5-8b6b-043d77a57cc6
75c785f9-a989-4550-8e02-ed9df5989a43,Huge sport treatment seat only much important.,2023-08-02 00:13:31,d974ff45-4b4c-4be5-8b6b-043d77a57cc6,adf3c75f-5653-4fe7-af17-5f932438b6b1
75c785f9-a989-4550-8e02-ed9df5989a43,Hit themselves sell race.,2023-07-31 14:42:29,d974ff45-4b4c-4be5-8b6b-043d77a57cc6,adf3c75f-5653-4fe7-af17-5f932438b6b1
b29fcf59-e16a-4986-a34a-f49238facfcb,Ability performance two lose what open production collection.,2023-07-30 17:13:07,dd5d216a-2df0-4a59-a335-07be66baec35,adf3c75f-5653-4fe7-af17-5f932438b6b1
b29fcf59-e16a-4986-a34a-f49238facfcb,Hospital culture box size. Policy whether able.,2023-07-30 12:56:47,dd5d216a-2df0-4a59-a335-07be66baec35,adf3c75f-5653-4fe7-af17-5f932438b6b1
b29fcf59-e16a-4986-a34a-f49238facfcb,Country onto option result truth resource. Culture film between entire turn. Enter drug this specific agree break live.,2023-08-01 09:58:12,adf3c75f-5653-4fe7-af17-5f932438b6b1,dd5d216a-2df0-4a59-a335-07be66baec35
b29fcf59-e16a-4986-a34a-f49238facfcb,Dinner anything example between. Style go night statement people forward at member.,2023-07-31 17:16:11,dd5d216a-2df0-4a59-a335-07be66baec35,adf3c75f-5653-4fe7-af17-5f932438b6b1
b29fcf59-e16a-4986-a34a-f49238facfcb,Why option upon community evidence child. Nature believe military leg. Minute issue his personal.,2023-07-30 04:35:38,adf3c75f-5653-4fe7-af17-5f932438b6b1,dd5d216a-2df0-4a59-a335-07be66baec35
f28318d4-4cd9-4860-931d-f6978cd2ad08,Include agree ago action. Community herself up bring soon.,2023-07-31 00:06:53,adf3c75f-5653-4fe7-af17-5f932438b6b1,9e2c6399-27c2-4350-b9f0-17b3f35b7d92
f28318d4-4cd9-4860-931d-f6978cd2ad08,Measure here we college decision product.,2023-07-29 12:08:51,adf3c75f-5653-4fe7-af17-5f932438b6b1,9e2c6399-27c2-4350-b9f0-17b3f35b7d92
f28318d4-4cd9-4860-931d-f6978cd2ad08,Accept east society hit sometimes. Write least lose lawyer can bad.,2023-07-27 16:45:41,adf3c75f-5653-4fe7-af17-5f932438b6b1,9e2c6399-27c2-4350-b9f0-17b3f35b7d92
f28318d4-4cd9-4860-931d-f6978cd2ad08,Leg clear travel moment. Ball meet leave lot might.,2023-07-30 10:18:04,adf3c75f-5653-4fe7-af17-5f932438b6b1,9e2c6399-27c2-4350-b9f0-17b3f35b7d92
f28318d4-4cd9-4860-931d-f6978cd2ad08,Work sport run before. Performance just pull also certain do.,2023-07-29 01:30:22,9e2c6399-27c2-4350-b9f0-17b3f35b7d92,adf3c75f-5653-4fe7-af17-5f932438b6b1
8e7edba3-8d37-4a17-a8aa-27249bd1513c,Model allow outside particular southern half program. Employee think church thank. Low deal responsibility although table.,2023-07-28 17:39:20,51ba5c70-9e4c-4142-bc85-dccad9df716f,5c6da620-b4d2-4d77-8947-d10b9526bfb3
8e7edba3-8d37-4a17-a8aa-27249bd1513c,Minute second record believe feeling simply. Age box future must instead. Green feel protect history.,2023-07-30 00:58:38,5c6da620-b4d2-4d77-8947-d10b9526bfb3,51ba5c70-9e4c-4142-bc85-dccad9df716f
