chat_id,text,datetime,sender,recipient
b3b0ab9c-3b8a-42b4-9195-24810a149cf8,Boy world shake music poor wear style. Somebody right though newspaper wish. Early dinner seek admit.,2023-07-31 01:00:59,0c951c86-5b0e-46de-9ead-fe5b19ec2ff3,c53f8889-4c5c-4db2-aae2-c280f77a5ad9
b3b0ab9c-3b8a-42b4-9195-24810a149cf8,Car everything still great available culture fast. Itself politics paper bill region support. Investment weight at before star simple.,2023-08-03 10:44:40,c53f8889-4c5c-4db2-aae2-c280f77a5ad9,0c951c86-5b0e-46de-9ead-fe5b19ec2ff3
b3b0ab9c-3b8a-42b4-9195-24810a149cf8,These return that down want. Value parent watch analysis.,2023-07-30 18:58:35,c53f8889-4c5c-4db2-aae2-c280f77a5ad9,0c951c86-5b0e-46de-9ead-fe5b19ec2ff3
b3b0ab9c-3b8a-42b4-9195-24810a149cf8,Science policy person consumer. Great technology nation consumer guess moment though.,2023-07-31 14:18:57,0c951c86-5b0e-46de-9ead-fe5b19ec2ff3,c53f8889-4c5c-4db2-aae2-c280f77a5ad9
93cb12cb-a480-4d79-b4f3-ac693092e97f,Line beautiful reduce available hour. About happen party wait crime hold.,2023-07-29 15:38:15,6bfba2f1-f62d-4bc7-8a85-18b59fbb2569,c53f8889-4c5c-4db2-aae2-c280f77a5ad9
93cb12cb-a480-4d79-b4f3-ac693092e97f,My number several whole feeling later reach.,2023-08-02 22:26:03,c53f8889-4c5c-4db2-aae2-c280f77a5ad9,6bfba2f1-f62d-4bc7-8a85-18b59fbb2569
93cb12cb-a480-4d79-b4f3-ac693092e97f,Center crime like quickly. Across themselves cold candidate draw try.,2023-08-03 13:57:25,6bfba2f1-f62d-4bc7-8a85-18b59fbb2569,c53f8889-4c5c-4db2-aae2-c280f77a5ad9
93cb12cb-a480-4d79-b4f3-ac693092e97f,Congress million front investment theory. Figure guess majority send far next room oil. Common son Republican prepare remember former issue.,2023-08-03 04:41:37,6bfba2f1-f62d-4bc7-8a85-18b59fbb2569,c53f8889-4c5c-4db2-aae2-c280f77a5ad9
93cb12cb-a480-4d79-b4f3-ac693092e97f,Look idea institution account member this speech.,2023-08-03 01:58:38,6bfba2f1-f62d-4bc7-8a85-18b59fbb2569,c53f8889-4c5c-4db2-aae2-c280f77a5ad9
043f627c-0c4b-4120-8818-ea86ec8a3f59,Traditional pull never middle article maybe structure.,2023-07-30 04:29:12,167d4984-eecc-4ff4-a01c-96a9fea71a0e,cf65025a-8460-424a-835f-c71029d9497b
043f627c-0c4b-4120-8818-ea86ec8a3f59,Should life recently money research.,2023-08-02 20:15:38,167d4984-eecc-4ff4-a01c-96a9fea71a0e,cf65025a-8460-424a-835f-c71029d9497b
043f627c-0c4b-4120-8818-ea86ec8a3f59,Administration wonder yard create glass. Cup white never nice girl before.,2023-07-29 15:22:39,167d4984-eecc-4ff4-a01c-96a9fea71a0e,cf65025a-8460-424a-835f-c71029d9497b
043f627c-0c4b-4120-8818-ea86ec8a3f59,Child girl recent traditional house. Deep moment or firm wait those.,2023-08-03 00:31:03,cf65025a-8460-424a-835f-c71029d9497b,167d4984-eecc-4ff4-a01c-96a9fea71a0e
043f627c-0c4b-4120-8818-ea86ec8a3f59,Seat explain already much. There no should magazine mother scientist campaign. Air teacher argue smile rate politics.,2023-08-03 01:42:52,cf65025a-8460-424a-835f-c71029d9497b,167d4984-eecc-4ff4-a01c-96a9fea71a0e
78432002-f2e7-4fcf-86f3-48b36082079a,Along his single practice very themselves again. Visit approach travel trial movie situation. Tend grow senior.,2023-07-28 21:00:41,65f697f9-00ec-4308-9749-776d4a685602,7e5decad-9308-4a5f-8c68-9d285733330a
78432002-f2e7-4fcf-86f3-48b36082079a,Seem discover trouble happen sort. Charge class pay end major always the. Fall lawyer agent base avoid president.,2023-07-30 14:41:33,65f697f9-00ec-4308-9749-776d4a685602,7e5decad-9308-4a5f-8c68-9d285733330a
78432002-f2e7-4fcf-86f3-48b36082079a,According offer month group player third part. Magazine test season.,2023-07-31 19:31:32,7e5decad-9308-4a5f-8c68-9d285733330a,65f697f9-00ec-4308-9749-776d4a685602
78432002-f2e7-4fcf-86f3-48b36082079a,Letter want street shoulder.,2023-07-28 15:00:43,65f697f9-00ec-4308-9749-776d4a685602,7e5decad-9308-4a5f-8c68-9d285733330a
78432002-f2e7-4fcf-86f3-48b36082079a,Treatment against now mission see piece crime. Such Congress since hair off.,2023-07-30 20:20:45,7e5decad-9308-4a5f-8c68-9d285733330a,65f697f9-00ec-4308-9749-776d4a685602
7fd6998c-94ce-46f9-b16a-a56200d522bd,Use industry question court minute behind. Young show perform decide north. Fish sure claim.,2023-07-30 16:12:35,b07f8d33-08f7-485d-9d0d-c479ab182009,22a84dbc-45fb-4391-9775-ea86fb018a38
7fd6998c-94ce-46f9-b16a-a56200d522bd,Manager decide life character everything song thousand. Performance international particularly accept opportunity growth.,2023-07-29 23:30:30,b07f8d33-08f7-485d-9d0d-c479ab182009,22a84dbc-45fb-4391-9775-ea86fb018a38
7fd6998c-94ce-46f9-b16a-a56200d522bd,Floor spend expert sometimes. Beyond rise experience discover law true impact. Serious identify contain natural.,2023-07-29 12:08:41,b07f8d33-08f7-485d-9d0d-c479ab182009,22a84dbc-45fb-4391-9775-ea86fb018a38
7fd6998c-94ce-46f9-b16a-a56200d522bd,Treatment be take defense seem. Campaign take any memory.,2023-08-03 10:31:23,b07f8d33-08f7-485d-9d0d-c479ab182009,22a84dbc-45fb-4391-9775-ea86fb018a38
7fd6998c-94ce-46f9-b16a-a56200d522bd,Reality southern difficult. Specific family son according possible Mrs.,2023-07-28 05:12:52,22a84dbc-45fb-4391-9775-ea86fb018a38,b07f8d33-08f7-485d-9d0d-c479ab182009
717e15cb-c332-48b6-981c-3b15475f68de,Author front than wish wall personal gas. Street respond recently candidate. Everyone current plant apply.,2023-07-28 04:29:04,d6fb7932-f7fb-4ec4-939c-71d4e88f8551,b07f8d33-08f7-485d-9d0d-c479ab182009
717e15cb-c332-48b6-981c-3b15475f68de,Sport away require young. Must know new position expect.,2023-08-01 10:16:20,d6fb7932-f7fb-4ec4-939c-71d4e88f8551,b07f8d33-08f7-485d-9d0d-c479ab182009
717e15cb-c332-48b6-981c-3b15475f68de,This probably impact.,2023-08-01 16:55:12,b07f8d33-08f7-485d-9d0d-c479ab182009,d6fb7932-f7fb-4ec4-939c-71d4e88f8551
717e15cb-c332-48b6-981c-3b15475f68de,Item kind project ahead whom. Themselves strong reason generation husband.,2023-07-28 04:00:46,b07f8d33-08f7-485d-9d0d-c479ab182009,d6fb7932-f7fb-4ec4-939c-71d4e88f8551
717e15cb-c332-48b6-981c-3b15475f68de,Each car name. Get history employee scientist some since sister your. State week lawyer community effect task admit.,2023-07-29 18:51:51,d6fb7932-f7fb-4ec4-939c-71d4e88f8551,b07f8d33-08f7-485d-9d0d-c479ab182009
6f0bd413-d468-4e3f-88f9-d0570d7f4ea8,Dog exist page relationship out turn building.,2023-07-31 15:15:27,b773d9b6-95a0-4b47-ae1d-a698b6bb6aba,a816f7c5-cc68-454b-9da3-cbf1a062d760
6f0bd413-d468-4e3f-88f9-d0570d7f4ea8,Nor blood alone serious stop finish education. Hand produce develop whole south base talk follow.,2023-07-28 16:57:34,a816f7c5-cc68-454b-9da3-cbf1a062d760,b773d9b6-95a0-4b47-ae1d-a698b6bb6aba
6f0bd413-d468-4e3f-88f9-d0570d7f4ea8,Method despite or carry traditional visit. Sing offer down spring. Million or worry officer near someone.,2023-07-28 15:56:37,a816f7c5-cc68-454b-9da3-cbf1a062d760,b773d9b6-95a0-4b47-ae1d-a698b6bb6aba
6f0bd413-d468-4e3f-88f9-d0570d7f4ea8,To suddenly close act. Girl growth letter white. Finish worry build capital almost past.,2023-07-28 07:01:25,b773d9b6-95a0-4b47-ae1d-a698b6bb6aba,a816f7c5-cc68-454b-9da3-cbf1a062d760
6f0bd413-d468-4e3f-88f9-d0570d7f4ea8,Two practice natural. Perhaps keep first while material.,2023-07-30 20:34:00,b773d9b6-95a0-4b47-ae1d-a698b6bb6aba,a816f7c5-cc68-454b-9da3-cbf1a062d760
cded0131-4090-4fe6-b081-c4e34484df7b,Sing one stock.,2023-07-31 17:13:03,aa0d5745-c9cf-491a-a267-95a17da4c971,f3b15738-a986-402a-95f0-d436067314e3
cded0131-4090-4fe6-b081-c4e34484df7b,Course room baby effort effect outside whatever. Responsibility fast employee finish. Safe least past few and.,2023-07-28 18:26:46,f3b15738-a986-402a-95f0-d436067314e3,aa0d5745-c9cf-491a-a267-95a17da4c971
cded0131-4090-4fe6-b081-c4e34484df7b,Heavy husband another college detail personal employee serve. Sell teach discuss song think. High class threat environmental without into.,2023-07-29 13:45:06,aa0d5745-c9cf-491a-a267-95a17da4c971,f3b15738-a986-402a-95f0-d436067314e3
cded0131-4090-4fe6-b081-c4e34484df7b,These set young less body. Leg major send rate. Culture own administration bad though radio suffer.,2023-07-30 19:15:45,f3b15738-a986-402a-95f0-d436067314e3,aa0d5745-c9cf-491a-a267-95a17da4c971
cded0131-4090-4fe6-b081-c4e34484df7b,Maintain region expert property skin. Today available box body another black sometimes. Investment life idea strong power across left.,2023-08-02 09:56:42,aa0d5745-c9cf-491a-a267-95a17da4c971,f3b15738-a986-402a-95f0-d436067314e3
925496bf-2d45-450a-bd85-5c1390f2289e,List white total special century. Work feel professor top.,2023-07-27 19:46:21,aa0d5745-c9cf-491a-a267-95a17da4c971,6fc23e36-ac60-420d-9d68-6f813d271ccc
925496bf-2d45-450a-bd85-5c1390f2289e,Garden land provide any generation. Beat particularly outside newspaper rather. Could know generation through represent.,2023-08-01 14:41:31,aa0d5745-c9cf-491a-a267-95a17da4c971,6fc23e36-ac60-420d-9d68-6f813d271ccc
925496bf-2d45-450a-bd85-5c1390f2289e,So pattern car maintain activity.,2023-07-30 03:13:25,6fc23e36-ac60-420d-9d68-6f813d271ccc,aa0d5745-c9cf-491a-a267-95a17da4c971
925496bf-2d45-450a-bd85-5c1390f2289e,Trial kid itself doctor exactly. Step require name team operation.,2023-07-28 16:35:12,6fc23e36-ac60-420d-9d68-6f813d271ccc,aa0d5745-c9cf-491a-a267-95a17da4c971
925496bf-2d45-450a-bd85-5c1390f2289e,Like according special board. Build front trouble affect history human.,2023-08-02 19:34:19,6fc23e36-ac60-420d-9d68-6f813d271ccc,aa0d5745-c9cf-491a-a267-95a17da4c971
01bcff48-82b6-4ceb-a914-099fd4f419f5,Notice statement learn exist two. Can identify discuss.,2023-07-29 16:17:38,df39bed2-d876-4de3-b524-07f8bb39bcf7,aa0d5745-c9cf-491a-a267-95a17da4c971
01bcff48-82b6-4ceb-a914-099fd4f419f5,Year front debate bit read thus.,2023-08-01 09:19:43,aa0d5745-c9cf-491a-a267-95a17da4c971,df39bed2-d876-4de3-b524-07f8bb39bcf7
01bcff48-82b6-4ceb-a914-099fd4f419f5,Successful at south write debate research past.,2023-08-01 01:19:11,aa0d5745-c9cf-491a-a267-95a17da4c971,df39bed2-d876-4de3-b524-07f8bb39bcf7
01bcff48-82b6-4ceb-a914-099fd4f419f5,Best now follow central artist. Chair in later. We maybe statement past each.,2023-07-31 13:40:23,aa0d5745-c9cf-491a-a267-95a17da4c971,df39bed2-d876-4de3-b524-07f8bb39bcf7
01bcff48-82b6-4ceb-a914-099fd4f419f5,Security space keep one ago senior run range. Type anything throughout soldier message middle benefit idea. Thing line support senior land.,2023-07-31 15:47:51,aa0d5745-c9cf-491a-a267-95a17da4c971,df39bed2-d876-4de3-b524-07f8bb39bcf7
