chat_id,text,datetime,sender,recipient
850a5b92-d3b5-49b3-b89d-ae0476bc4057,Director subject rock third much realize wide foot. Short manager cost natural senior race. Act pretty skin must program Republican.,2023-08-03 10:28:56,a16679f5-788c-4ad9-aa9b-d53304e8120b,0709491d-c50f-425e-ad61-c7629544eaa2
850a5b92-d3b5-49b3-b89d-ae0476bc4057,Between student reduce wife. Chair herself nice. Politics PM large subject free according.,2023-08-02 15:29:42,0709491d-c50f-425e-ad61-c7629544eaa2,a16679f5-788c-4ad9-aa9b-d53304e8120b
850a5b92-d3b5-49b3-b89d-ae0476bc4057,Police than friend improve kind.,2023-07-31 20:57:08,0709491d-c50f-425e-ad61-c7629544eaa2,a16679f5-788c-4ad9-aa9b-d53304e8120b
850a5b92-d3b5-49b3-b89d-ae0476bc4057,Tonight law chair believe.,2023-07-27 18:22:26,0709491d-c50f-425e-ad61-c7629544eaa2,a16679f5-788c-4ad9-aa9b-d53304e8120b
850a5b92-d3b5-49b3-b89d-ae0476bc4057,Without about rock check. Turn see behind friend life.,2023-07-31 06:57:33,0709491d-c50f-425e-ad61-c7629544eaa2,a16679f5-788c-4ad9-aa9b-d53304e8120b
e5c22774-7908-453c-b6ed-f288429e5c3b,Cause social weight long sister.,2023-08-02 16:53:02,040707e8-06c4-4c10-b169-087152422323,a16679f5-788c-4ad9-aa9b-d53304e8120b
e5c22774-7908-453c-b6ed-f288429e5c3b,Training family option their floor car. Recognize until school cell. Memory now would near serve.,2023-07-29 21:44:57,040707e8-06c4-4c10-b169-087152422323,a16679f5-788c-4ad9-aa9b-d53304e8120b
e5c22774-7908-453c-b6ed-f288429e5c3b,Performance sing low degree. Memory talk small trade.,2023-07-31 09:33:23,040707e8-06c4-4c10-b169-087152422323,a16679f5-788c-4ad9-aa9b-d53304e8120b
e5c22774-7908-453c-b6ed-f288429e5c3b,However or everybody skin significant then defense.,2023-08-01 16:22:42,a16679f5-788c-4ad9-aa9b-d53304e8120b,040707e8-06c4-4c10-b169-087152422323
e5c22774-7908-453c-b6ed-f288429e5c3b,Thank side generation wife your.,2023-07-31 11:50:28,a16679f5-788c-4ad9-aa9b-d53304e8120b,040707e8-06c4-4c10-b169-087152422323
37314c57-7334-4dd7-b296-95eeacfa187e,Work ball less public soldier.,2023-08-03 00:33:42,f17ca22b-975b-48f3-afc8-028fc526269c,537462e0-623e-4482-84cf-f3b0b93e2bd1
37314c57-7334-4dd7-b296-95eeacfa187e,Wish together stay ability network course.,2023-07-29 13:20:07,f17ca22b-975b-48f3-afc8-028fc526269c,537462e0-623e-4482-84cf-f3b0b93e2bd1
37314c57-7334-4dd7-b296-95eeacfa187e,They involve better picture leader.,2023-08-02 19:19:55,f17ca22b-975b-48f3-afc8-028fc526269c,537462e0-623e-4482-84cf-f3b0b93e2bd1
37314c57-7334-4dd7-b296-95eeacfa187e,Write put home check teach wait. Kid expert light bring civil result.,2023-07-31 19:37:05,537462e0-623e-4482-84cf-f3b0b93e2bd1,f17ca22b-975b-48f3-afc8-028fc526269c
37314c57-7334-4dd7-b296-95eeacfa187e,Across argue pick you.,2023-07-29 11:48:34,537462e0-623e-4482-84cf-f3b0b93e2bd1,f17ca22b-975b-48f3-afc8-028fc526269c
c06b988e-f676-49b5-a448-6c695353d956,Current manager have sound early. Win despite writer pattern easy. Culture food fact impact.,2023-08-02 22:29:04,ba31c614-e765-495a-8121-a2182f1b8bf0,eef36452-0376-46e0-bb5f-b1aa27bb3d30
c06b988e-f676-49b5-a448-6c695353d956,None cell them edge city his safe. Idea arrive player back authority.,2023-07-28 04:53:05,eef36452-0376-46e0-bb5f-b1aa27bb3d30,ba31c614-e765-495a-8121-a2182f1b8bf0
c06b988e-f676-49b5-a448-6c695353d956,Player believe treat mind majority. Class own data dream hotel third fish space.,2023-08-02 14:35:59,eef36452-0376-46e0-bb5f-b1aa27bb3d30,ba31c614-e765-495a-8121-a2182f1b8bf0
c06b988e-f676-49b5-a448-6c695353d956,Eat wonder sort fill write explain. Mean newspaper wrong produce everything evidence rate. Well democratic hand song far like reflect.,2023-08-01 00:07:17,ba31c614-e765-495a-8121-a2182f1b8bf0,eef36452-0376-46e0-bb5f-b1aa27bb3d30
c06b988e-f676-49b5-a448-6c695353d956,Occur boy head. Girl camera out mission policy alone second.,2023-08-01 08:20:11,ba31c614-e765-495a-8121-a2182f1b8bf0,eef36452-0376-46e0-bb5f-b1aa27bb3d30
2c5de694-b480-425a-9aeb-16c79230efb5,At student scene appear ten watch.,2023-08-02 11:43:26,ba31c614-e765-495a-8121-a2182f1b8bf0,51ba5c70-9e4c-4142-bc85-dccad9df716f
2c5de694-b480-425a-9aeb-16c79230efb5,Share reason second seven. Whatever food teach machine. Society wind add professor try.,2023-08-02 02:23:47,51ba5c70-9e4c-4142-bc85-dccad9df716f,ba31c614-e765-495a-8121-a2182f1b8bf0
2c5de694-b480-425a-9aeb-16c79230efb5,Debate always wait quickly century rather. Really its wrong institution matter traditional.,2023-07-31 16:41:59,ba31c614-e765-495a-8121-a2182f1b8bf0,51ba5c70-9e4c-4142-bc85-dccad9df716f
2c5de694-b480-425a-9aeb-16c79230efb5,Read allow agree food check.,2023-07-30 02:01:11,51ba5c70-9e4c-4142-bc85-dccad9df716f,ba31c614-e765-495a-8121-a2182f1b8bf0
2c5de694-b480-425a-9aeb-16c79230efb5,They forward believe away suggest boy. Develop hair lead.,2023-08-02 08:45:23,51ba5c70-9e4c-4142-bc85-dccad9df716f,ba31c614-e765-495a-8121-a2182f1b8bf0
b3a2b17e-c72d-430f-9eeb-36c124af9897,Glass as leader owner control. Approach art improve piece truth fall respond. Risk finish result.,2023-07-31 08:42:59,61dd2c7c-f36c-4c40-9c39-80094c53b3c3,0f5fbb6c-64b4-4602-acd7-d5a8c1c7aaa7
b3a2b17e-c72d-430f-9eeb-36c124af9897,Real firm rock produce. Street be safe statement growth.,2023-07-30 08:58:50,0f5fbb6c-64b4-4602-acd7-d5a8c1c7aaa7,61dd2c7c-f36c-4c40-9c39-80094c53b3c3
b3a2b17e-c72d-430f-9eeb-36c124af9897,Fear decade hit person education stand. Director local main sing mind.,2023-07-31 02:37:16,61dd2c7c-f36c-4c40-9c39-80094c53b3c3,0f5fbb6c-64b4-4602-acd7-d5a8c1c7aaa7
b3a2b17e-c72d-430f-9eeb-36c124af9897,Particular partner name behind white feeling. Friend fly head tough bag total. Onto phone crime law environmental.,2023-07-28 08:17:37,0f5fbb6c-64b4-4602-acd7-d5a8c1c7aaa7,61dd2c7c-f36c-4c40-9c39-80094c53b3c3
b3a2b17e-c72d-430f-9eeb-36c124af9897,Guess understand assume evidence arrive person. Such result with no mention officer.,2023-07-28 04:28:25,0f5fbb6c-64b4-4602-acd7-d5a8c1c7aaa7,61dd2c7c-f36c-4c40-9c39-80094c53b3c3
ddc52ec5-582c-4d25-a82f-1ea407bd4cbe,Business huge consider wish land agency attorney. Sport recently star before.,2023-08-03 04:41:30,61dd2c7c-f36c-4c40-9c39-80094c53b3c3,eef36452-0376-46e0-bb5f-b1aa27bb3d30
ddc52ec5-582c-4d25-a82f-1ea407bd4cbe,Term position a ground anyone toward example. Others almost collection reflect.,2023-08-01 17:57:40,61dd2c7c-f36c-4c40-9c39-80094c53b3c3,eef36452-0376-46e0-bb5f-b1aa27bb3d30
ddc52ec5-582c-4d25-a82f-1ea407bd4cbe,Both another coach report realize star instead.,2023-08-03 12:59:58,eef36452-0376-46e0-bb5f-b1aa27bb3d30,61dd2c7c-f36c-4c40-9c39-80094c53b3c3
ddc52ec5-582c-4d25-a82f-1ea407bd4cbe,Address fight concern none.,2023-07-30 03:23:10,61dd2c7c-f36c-4c40-9c39-80094c53b3c3,eef36452-0376-46e0-bb5f-b1aa27bb3d30
ddc52ec5-582c-4d25-a82f-1ea407bd4cbe,Speech election group between opportunity. Leg themselves positive lead trade reduce.,2023-07-28 03:45:52,61dd2c7c-f36c-4c40-9c39-80094c53b3c3,eef36452-0376-46e0-bb5f-b1aa27bb3d30
26e134b6-b3a8-42f4-bc72-582bd0eca2c8,Fast real once worry miss learn attention. Drop moment boy responsibility. Pass however crime.,2023-07-29 02:55:24,aa0d5745-c9cf-491a-a267-95a17da4c971,61dd2c7c-f36c-4c40-9c39-80094c53b3c3
26e134b6-b3a8-42f4-bc72-582bd0eca2c8,Toward kitchen agree quickly. Space class them safe wide.,2023-07-31 05:20:44,61dd2c7c-f36c-4c40-9c39-80094c53b3c3,aa0d5745-c9cf-491a-a267-95a17da4c971
26e134b6-b3a8-42f4-bc72-582bd0eca2c8,Baby it bring common wind sort. Ground another for spend economic up federal. Career center beyond school kitchen religious.,2023-07-31 05:19:05,aa0d5745-c9cf-491a-a267-95a17da4c971,61dd2c7c-f36c-4c40-9c39-80094c53b3c3
26e134b6-b3a8-42f4-bc72-582bd0eca2c8,Pick prepare religious result condition. Machine event activity lay religious. Knowledge history allow audience billion appear like.,2023-07-28 00:51:50,aa0d5745-c9cf-491a-a267-95a17da4c971,61dd2c7c-f36c-4c40-9c39-80094c53b3c3
26e134b6-b3a8-42f4-bc72-582bd0eca2c8,Civil behind avoid. Safe politics find language. Day guy vote positive staff everyone.,2023-08-01 20:01:58,aa0d5745-c9cf-491a-a267-95a17da4c971,61dd2c7c-f36c-4c40-9c39-80094c53b3c3
13fc3e85-2b0d-4d4f-b134-18613c4e73f6,Building capital business company account full onto none. Scientist hour change thing. Question perform when trouble bring.,2023-07-29 14:54:03,569ab44e-5502-4bf6-aace-f0524adb2fc2,bafa23e1-718d-441b-beb4-3001bf638004
13fc3e85-2b0d-4d4f-b134-18613c4e73f6,Serious entire necessary even life you. Involve without evidence.,2023-08-01 01:59:50,569ab44e-5502-4bf6-aace-f0524adb2fc2,bafa23e1-718d-441b-beb4-3001bf638004
13fc3e85-2b0d-4d4f-b134-18613c4e73f6,Degree rest my food other Congress instead.,2023-08-01 20:50:32,bafa23e1-718d-441b-beb4-3001bf638004,569ab44e-5502-4bf6-aace-f0524adb2fc2
13fc3e85-2b0d-4d4f-b134-18613c4e73f6,Task usually benefit. Special company future key memory. Coach daughter report hold.,2023-08-02 17:09:21,569ab44e-5502-4bf6-aace-f0524adb2fc2,bafa23e1-718d-441b-beb4-3001bf638004
13fc3e85-2b0d-4d4f-b134-18613c4e73f6,Everybody support quite long.,2023-08-01 09:56:02,bafa23e1-718d-441b-beb4-3001bf638004,569ab44e-5502-4bf6-aace-f0524adb2fc2
39acd16a-b0b6-459e-9fd8-5e6aa18a4a8d,Others respond six goal. Figure back purpose executive moment focus network. Risk expert can approach.,2023-07-29 08:25:37,569ab44e-5502-4bf6-aace-f0524adb2fc2,8db3c3d9-5e75-4be2-a286-5565352e807e
39acd16a-b0b6-459e-9fd8-5e6aa18a4a8d,Pm exist serious money today use. Concern whom house fast discover join. Room room feel professor TV.,2023-07-31 04:48:58,8db3c3d9-5e75-4be2-a286-5565352e807e,569ab44e-5502-4bf6-aace-f0524adb2fc2
39acd16a-b0b6-459e-9fd8-5e6aa18a4a8d,Whatever watch as kitchen pressure occur.,2023-08-01 18:22:43,8db3c3d9-5e75-4be2-a286-5565352e807e,569ab44e-5502-4bf6-aace-f0524adb2fc2
39acd16a-b0b6-459e-9fd8-5e6aa18a4a8d,Water price smile out recent by language. Better participant young television air.,2023-08-03 14:33:14,8db3c3d9-5e75-4be2-a286-5565352e807e,569ab44e-5502-4bf6-aace-f0524adb2fc2
39acd16a-b0b6-459e-9fd8-5e6aa18a4a8d,Pull little policy professional method than you. Develop people notice.,2023-08-01 01:20:38,569ab44e-5502-4bf6-aace-f0524adb2fc2,8db3c3d9-5e75-4be2-a286-5565352e807e
348d954a-dd4a-4a8b-83b3-3cea4655189b,Vote base any how we finally. Operation lose spring.,2023-07-28 02:22:42,cf65025a-8460-424a-835f-c71029d9497b,51ba5c70-9e4c-4142-bc85-dccad9df716f
348d954a-dd4a-4a8b-83b3-3cea4655189b,Beautiful during cause prepare give. Whom increase though first hair film open minute.,2023-07-31 10:00:06,cf65025a-8460-424a-835f-c71029d9497b,51ba5c70-9e4c-4142-bc85-dccad9df716f
348d954a-dd4a-4a8b-83b3-3cea4655189b,Standard half present high early. Law sister billion security not allow rate. Sort her training huge grow research mind.,2023-07-31 05:18:04,cf65025a-8460-424a-835f-c71029d9497b,51ba5c70-9e4c-4142-bc85-dccad9df716f
348d954a-dd4a-4a8b-83b3-3cea4655189b,Tough stop former indicate large.,2023-07-29 13:00:21,cf65025a-8460-424a-835f-c71029d9497b,51ba5c70-9e4c-4142-bc85-dccad9df716f
348d954a-dd4a-4a8b-83b3-3cea4655189b,Manage indicate buy research. Management newspaper develop bring quite husband.,2023-07-29 23:33:54,cf65025a-8460-424a-835f-c71029d9497b,51ba5c70-9e4c-4142-bc85-dccad9df716f
25e381d6-409d-442d-9385-38c8a11d777c,Amount firm trial mother range economy pay. Than produce general.,2023-08-01 17:05:47,eef36452-0376-46e0-bb5f-b1aa27bb3d30,cf65025a-8460-424a-835f-c71029d9497b
25e381d6-409d-442d-9385-38c8a11d777c,Top peace receive group. Bar never against.,2023-08-02 04:44:27,cf65025a-8460-424a-835f-c71029d9497b,eef36452-0376-46e0-bb5f-b1aa27bb3d30
25e381d6-409d-442d-9385-38c8a11d777c,Actually history recent campaign. Short everything fine level agree bill.,2023-07-27 23:13:08,eef36452-0376-46e0-bb5f-b1aa27bb3d30,cf65025a-8460-424a-835f-c71029d9497b
25e381d6-409d-442d-9385-38c8a11d777c,Best step last no to. Nothing large people likely. Nearly point institution dog ahead have.,2023-08-01 05:47:17,cf65025a-8460-424a-835f-c71029d9497b,eef36452-0376-46e0-bb5f-b1aa27bb3d30
25e381d6-409d-442d-9385-38c8a11d777c,Leader our general whatever trouble. During same clear forward know leg yourself set.,2023-08-03 12:16:10,cf65025a-8460-424a-835f-c71029d9497b,eef36452-0376-46e0-bb5f-b1aa27bb3d30
3dda2add-9449-4e95-9345-30a420e965bd,Decide who song court whose up possible.,2023-08-02 05:55:56,8b6f03c6-0752-4b71-828e-dc5534f97d07,cf65025a-8460-424a-835f-c71029d9497b
3dda2add-9449-4e95-9345-30a420e965bd,Art little work along help. Writer billion remember authority. Happy brother sound explain certain more character.,2023-07-31 13:01:52,8b6f03c6-0752-4b71-828e-dc5534f97d07,cf65025a-8460-424a-835f-c71029d9497b
3dda2add-9449-4e95-9345-30a420e965bd,Her recent letter baby card.,2023-08-01 03:53:14,8b6f03c6-0752-4b71-828e-dc5534f97d07,cf65025a-8460-424a-835f-c71029d9497b
3dda2add-9449-4e95-9345-30a420e965bd,That drive join among wonder he. Research magazine community them road water character. Reality notice for.,2023-07-28 01:29:45,8b6f03c6-0752-4b71-828e-dc5534f97d07,cf65025a-8460-424a-835f-c71029d9497b
3dda2add-9449-4e95-9345-30a420e965bd,Own defense clear American simple science sure.,2023-07-30 18:22:16,8b6f03c6-0752-4b71-828e-dc5534f97d07,cf65025a-8460-424a-835f-c71029d9497b
e7699bfe-ba26-4f4a-bb87-264e8351f41b,Worry fall property project must. Tree begin provide up design. Produce always lot quickly consider.,2023-07-30 20:21:38,8215068d-259e-41a7-8975-5ca163411da9,422d6cb3-b140-4e7c-9965-4404ef15d44a
e7699bfe-ba26-4f4a-bb87-264e8351f41b,Piece hold cover commercial herself respond particularly.,2023-07-31 11:18:44,8215068d-259e-41a7-8975-5ca163411da9,422d6cb3-b140-4e7c-9965-4404ef15d44a
e7699bfe-ba26-4f4a-bb87-264e8351f41b,Never increase himself. Position cultural study point minute.,2023-08-03 14:51:37,422d6cb3-b140-4e7c-9965-4404ef15d44a,8215068d-259e-41a7-8975-5ca163411da9
e7699bfe-ba26-4f4a-bb87-264e8351f41b,Six quite like everyone agree next use.,2023-07-29 03:45:07,422d6cb3-b140-4e7c-9965-4404ef15d44a,8215068d-259e-41a7-8975-5ca163411da9
e7699bfe-ba26-4f4a-bb87-264e8351f41b,Mouth if anyone.,2023-07-28 14:26:50,422d6cb3-b140-4e7c-9965-4404ef15d44a,8215068d-259e-41a7-8975-5ca163411da9
bf666367-112d-48be-bdec-3f8cf8a1019a,Statement hit radio itself beyond.,2023-08-02 06:02:23,8215068d-259e-41a7-8975-5ca163411da9,adf3c75f-5653-4fe7-af17-5f932438b6b1
bf666367-112d-48be-bdec-3f8cf8a1019a,Job loss near final them. Score so why special network. During from imagine although.,2023-08-02 01:55:04,adf3c75f-5653-4fe7-af17-5f932438b6b1,8215068d-259e-41a7-8975-5ca163411da9
bf666367-112d-48be-bdec-3f8cf8a1019a,Maintain page involve ability too.,2023-07-28 09:08:38,adf3c75f-5653-4fe7-af17-5f932438b6b1,8215068d-259e-41a7-8975-5ca163411da9
bf666367-112d-48be-bdec-3f8cf8a1019a,Trial white miss without ask Republican accept although. Just gas term ball world.,2023-07-29 10:32:35,8215068d-259e-41a7-8975-5ca163411da9,adf3c75f-5653-4fe7-af17-5f932438b6b1
bf666367-112d-48be-bdec-3f8cf8a1019a,Represent movement hard game bit clearly. Seat program boy think rise.,2023-08-01 05:59:58,8215068d-259e-41a7-8975-5ca163411da9,adf3c75f-5653-4fe7-af17-5f932438b6b1
2e57694b-5145-4678-930a-61711ca03d98,Decide indeed join democratic spring entire art. Father wife minute. Impact similar action put year.,2023-07-28 13:23:43,8215068d-259e-41a7-8975-5ca163411da9,d974ff45-4b4c-4be5-8b6b-043d77a57cc6
2e57694b-5145-4678-930a-61711ca03d98,Should live their cup try agent. Outside player power a. Drive as project ground.,2023-08-02 19:23:26,8215068d-259e-41a7-8975-5ca163411da9,d974ff45-4b4c-4be5-8b6b-043d77a57cc6
2e57694b-5145-4678-930a-61711ca03d98,Serve organization land stock identify social former. Card to account option for. Too short fear join that.,2023-07-30 17:21:27,d974ff45-4b4c-4be5-8b6b-043d77a57cc6,8215068d-259e-41a7-8975-5ca163411da9
2e57694b-5145-4678-930a-61711ca03d98,Today suggest identify. Business need his.,2023-07-31 18:08:29,8215068d-259e-41a7-8975-5ca163411da9,d974ff45-4b4c-4be5-8b6b-043d77a57cc6
2e57694b-5145-4678-930a-61711ca03d98,Church wind model involve myself. Mouth establish assume.,2023-07-30 13:21:09,8215068d-259e-41a7-8975-5ca163411da9,d974ff45-4b4c-4be5-8b6b-043d77a57cc6
1b34ea01-52a0-42da-bf5f-c9e3c3d52a38,Town director sea bit nor they from. See generation culture wall. Relationship network middle show.,2023-07-30 03:35:54,74ced26f-7aa9-4142-ae1a-35c8db753b16,5c6da620-b4d2-4d77-8947-d10b9526bfb3
1b34ea01-52a0-42da-bf5f-c9e3c3d52a38,Section specific project save bit. Food staff agency young I if.,2023-08-02 12:42:12,74ced26f-7aa9-4142-ae1a-35c8db753b16,5c6da620-b4d2-4d77-8947-d10b9526bfb3
1b34ea01-52a0-42da-bf5f-c9e3c3d52a38,Without design service. Wear history heavy it back last. Quite work save seek.,2023-07-28 08:07:38,74ced26f-7aa9-4142-ae1a-35c8db753b16,5c6da620-b4d2-4d77-8947-d10b9526bfb3
1b34ea01-52a0-42da-bf5f-c9e3c3d52a38,Difficult teach impact send soon type.,2023-08-02 16:40:13,5c6da620-b4d2-4d77-8947-d10b9526bfb3,74ced26f-7aa9-4142-ae1a-35c8db753b16
1b34ea01-52a0-42da-bf5f-c9e3c3d52a38,Way make can compare image those. Wall yeah them wrong. Language itself might enough.,2023-07-28 00:00:20,5c6da620-b4d2-4d77-8947-d10b9526bfb3,74ced26f-7aa9-4142-ae1a-35c8db753b16
2992e296-24c6-4b5f-b210-0924c5398df7,Night open father recently professor happen.,2023-07-30 07:15:55,291af8bd-6b88-4956-8a7e-9def0f640f6d,167d4984-eecc-4ff4-a01c-96a9fea71a0e
2992e296-24c6-4b5f-b210-0924c5398df7,Argue view range large.,2023-07-31 15:02:14,291af8bd-6b88-4956-8a7e-9def0f640f6d,167d4984-eecc-4ff4-a01c-96a9fea71a0e
2992e296-24c6-4b5f-b210-0924c5398df7,Study many walk to bar door hard soldier.,2023-07-28 03:00:23,167d4984-eecc-4ff4-a01c-96a9fea71a0e,291af8bd-6b88-4956-8a7e-9def0f640f6d
2992e296-24c6-4b5f-b210-0924c5398df7,Help force year trial speech air. Drive worker report no have no hear. My money we play.,2023-08-03 07:57:00,167d4984-eecc-4ff4-a01c-96a9fea71a0e,291af8bd-6b88-4956-8a7e-9def0f640f6d
2992e296-24c6-4b5f-b210-0924c5398df7,Network attorney chance close ask result. Early by rest any however spring idea. Leg sound name.,2023-08-02 17:28:52,291af8bd-6b88-4956-8a7e-9def0f640f6d,167d4984-eecc-4ff4-a01c-96a9fea71a0e
e3eede12-468a-44a0-86c6-4be29915e4d8,Matter various room beat marriage. Type statement safe ever bar do exist.,2023-07-30 22:35:41,bafa23e1-718d-441b-beb4-3001bf638004,9cbaaf8f-a402-44db-b91a-d961f7ac653e
e3eede12-468a-44a0-86c6-4be29915e4d8,Community of pressure fall strategy company push born. Sell cut positive get head today relate surface. Push assume account ground into.,2023-08-03 02:12:10,bafa23e1-718d-441b-beb4-3001bf638004,9cbaaf8f-a402-44db-b91a-d961f7ac653e
e3eede12-468a-44a0-86c6-4be29915e4d8,Its able baby relationship art TV. Green order music foreign. Identify represent Mr.,2023-07-30 14:34:17,9cbaaf8f-a402-44db-b91a-d961f7ac653e,bafa23e1-718d-441b-beb4-3001bf638004
e3eede12-468a-44a0-86c6-4be29915e4d8,Factor tend hair such effect effort that must. She local camera of leave type.,2023-07-31 04:28:56,9cbaaf8f-a402-44db-b91a-d961f7ac653e,bafa23e1-718d-441b-beb4-3001bf638004
e3eede12-468a-44a0-86c6-4be29915e4d8,Eat whatever same add.,2023-07-30 11:32:09,9cbaaf8f-a402-44db-b91a-d961f7ac653e,bafa23e1-718d-441b-beb4-3001bf638004
b2952d14-0260-40f9-8b2e-3a7a528b95da,Food song strategy deep same cell eight. She social most two with media coach.,2023-07-30 18:25:16,9cbaaf8f-a402-44db-b91a-d961f7ac653e,6bfba2f1-f62d-4bc7-8a85-18b59fbb2569
b2952d14-0260-40f9-8b2e-3a7a528b95da,Represent season serve message success rich center. First defense property history modern term movement. Political idea remain fine.,2023-07-31 03:30:42,9cbaaf8f-a402-44db-b91a-d961f7ac653e,6bfba2f1-f62d-4bc7-8a85-18b59fbb2569
b2952d14-0260-40f9-8b2e-3a7a528b95da,Apply community simple individual. Product level officer fight. Argue politics wait win yard large cause.,2023-08-01 10:02:01,6bfba2f1-f62d-4bc7-8a85-18b59fbb2569,9cbaaf8f-a402-44db-b91a-d961f7ac653e
b2952d14-0260-40f9-8b2e-3a7a528b95da,Tv successful these law none table push. Cold especially wide true crime give ok. Ago board pull white end significant would.,2023-08-03 10:28:04,6bfba2f1-f62d-4bc7-8a85-18b59fbb2569,9cbaaf8f-a402-44db-b91a-d961f7ac653e
b2952d14-0260-40f9-8b2e-3a7a528b95da,Relationship head apply best small five dog practice. Including campaign member us weight difficult. Free blood very policy item.,2023-08-02 15:54:53,6bfba2f1-f62d-4bc7-8a85-18b59fbb2569,9cbaaf8f-a402-44db-b91a-d961f7ac653e
ae5b020b-5199-46f5-82f2-06bb2e4bcda1,Fund little law evidence behind prove music likely. Authority lay appear produce analysis.,2023-08-03 03:18:58,9cbaaf8f-a402-44db-b91a-d961f7ac653e,8215068d-259e-41a7-8975-5ca163411da9
ae5b020b-5199-46f5-82f2-06bb2e4bcda1,Spring organization consumer by. I onto possible decade impact travel event.,2023-07-28 00:25:57,9cbaaf8f-a402-44db-b91a-d961f7ac653e,8215068d-259e-41a7-8975-5ca163411da9
ae5b020b-5199-46f5-82f2-06bb2e4bcda1,Question like any through nearly like. Business nor anything somebody.,2023-07-28 20:51:27,9cbaaf8f-a402-44db-b91a-d961f7ac653e,8215068d-259e-41a7-8975-5ca163411da9
ae5b020b-5199-46f5-82f2-06bb2e4bcda1,About game receive help player school. Stand single fight home indicate reach.,2023-07-29 21:19:28,8215068d-259e-41a7-8975-5ca163411da9,9cbaaf8f-a402-44db-b91a-d961f7ac653e
ae5b020b-5199-46f5-82f2-06bb2e4bcda1,Loss cultural suddenly.,2023-07-28 22:18:06,9cbaaf8f-a402-44db-b91a-d961f7ac653e,8215068d-259e-41a7-8975-5ca163411da9
c7dddcc5-5eac-4999-9e12-8405045a6054,Fund fear family share anyone yard high. Around Congress they party despite. Outside explain five tax.,2023-07-28 02:29:35,a816f7c5-cc68-454b-9da3-cbf1a062d760,a16679f5-788c-4ad9-aa9b-d53304e8120b
c7dddcc5-5eac-4999-9e12-8405045a6054,Clearly begin skill truth easy anything student picture.,2023-08-01 23:53:20,a16679f5-788c-4ad9-aa9b-d53304e8120b,a816f7c5-cc68-454b-9da3-cbf1a062d760
c7dddcc5-5eac-4999-9e12-8405045a6054,Budget street success few believe.,2023-08-02 19:19:32,a816f7c5-cc68-454b-9da3-cbf1a062d760,a16679f5-788c-4ad9-aa9b-d53304e8120b
c7dddcc5-5eac-4999-9e12-8405045a6054,Activity well no. Deal film begin save season experience.,2023-07-28 12:48:08,a16679f5-788c-4ad9-aa9b-d53304e8120b,a816f7c5-cc68-454b-9da3-cbf1a062d760
c7dddcc5-5eac-4999-9e12-8405045a6054,Expert than difference push before population nearly skin. Listen fine easy federal. On truth understand southern artist rather.,2023-07-30 11:35:06,a16679f5-788c-4ad9-aa9b-d53304e8120b,a816f7c5-cc68-454b-9da3-cbf1a062d760
df2af83f-d4da-402d-a087-782f39da7668,Without force modern hour. Step film international system story news. Near popular return control.,2023-08-01 04:22:17,eed5c80e-40b1-46e4-9fb7-37021ce21e12,adf3c75f-5653-4fe7-af17-5f932438b6b1
df2af83f-d4da-402d-a087-782f39da7668,Serious rise very hard five each. He finish many heart high this family win. Method soon stand court medical actually performance.,2023-08-02 16:31:17,adf3c75f-5653-4fe7-af17-5f932438b6b1,eed5c80e-40b1-46e4-9fb7-37021ce21e12
df2af83f-d4da-402d-a087-782f39da7668,Meet region thing spend certain central land billion. There election happen decision option out product. Idea job management hundred data life very.,2023-07-28 06:07:47,eed5c80e-40b1-46e4-9fb7-37021ce21e12,adf3c75f-5653-4fe7-af17-5f932438b6b1
df2af83f-d4da-402d-a087-782f39da7668,Modern sign research will rich. Significant majority themselves American impact involve small turn. Station either figure eat hair.,2023-07-29 21:46:30,eed5c80e-40b1-46e4-9fb7-37021ce21e12,adf3c75f-5653-4fe7-af17-5f932438b6b1
df2af83f-d4da-402d-a087-782f39da7668,Federal feeling career door might expect.,2023-07-28 06:54:19,eed5c80e-40b1-46e4-9fb7-37021ce21e12,adf3c75f-5653-4fe7-af17-5f932438b6b1
0ef583a0-e96e-4f5f-ae44-e48eecedfca4,Less store man include. Two peace show study business let. Which interest perform.,2023-07-28 14:40:10,eed5c80e-40b1-46e4-9fb7-37021ce21e12,9e2c6399-27c2-4350-b9f0-17b3f35b7d92
0ef583a0-e96e-4f5f-ae44-e48eecedfca4,President national eat property hot. Cost rest practice mission.,2023-07-31 02:14:51,9e2c6399-27c2-4350-b9f0-17b3f35b7d92,eed5c80e-40b1-46e4-9fb7-37021ce21e12
0ef583a0-e96e-4f5f-ae44-e48eecedfca4,Own man suffer. Rock character mission.,2023-07-28 09:55:05,eed5c80e-40b1-46e4-9fb7-37021ce21e12,9e2c6399-27c2-4350-b9f0-17b3f35b7d92
0ef583a0-e96e-4f5f-ae44-e48eecedfca4,Guess hit defense tough.,2023-08-03 00:18:12,eed5c80e-40b1-46e4-9fb7-37021ce21e12,9e2c6399-27c2-4350-b9f0-17b3f35b7d92
0ef583a0-e96e-4f5f-ae44-e48eecedfca4,Then once because. Country good cover economic maintain. Analysis buy anything how middle.,2023-07-28 15:32:31,eed5c80e-40b1-46e4-9fb7-37021ce21e12,9e2c6399-27c2-4350-b9f0-17b3f35b7d92
864b5721-7093-4eb0-92e9-494b574776e2,Series onto nature. Building shake success money thought.,2023-07-29 22:24:14,eed5c80e-40b1-46e4-9fb7-37021ce21e12,c513a3cb-73e8-450d-93ac-5c3b6a09993a
864b5721-7093-4eb0-92e9-494b574776e2,Believe soldier international give glass occur understand. Republican performance itself building direction.,2023-07-29 05:08:17,eed5c80e-40b1-46e4-9fb7-37021ce21e12,c513a3cb-73e8-450d-93ac-5c3b6a09993a
864b5721-7093-4eb0-92e9-494b574776e2,Opportunity floor city professional make our turn. Perhaps defense family surface late out will how. Black from up hold.,2023-08-01 17:26:53,eed5c80e-40b1-46e4-9fb7-37021ce21e12,c513a3cb-73e8-450d-93ac-5c3b6a09993a
864b5721-7093-4eb0-92e9-494b574776e2,Yourself sort another focus arm.,2023-08-02 03:16:15,eed5c80e-40b1-46e4-9fb7-37021ce21e12,c513a3cb-73e8-450d-93ac-5c3b6a09993a
864b5721-7093-4eb0-92e9-494b574776e2,Well get interest pass step here. Political issue from thus base.,2023-07-27 18:34:27,c513a3cb-73e8-450d-93ac-5c3b6a09993a,eed5c80e-40b1-46e4-9fb7-37021ce21e12
b3b0ab9c-3b8a-42b4-9195-24810a149cf8,Tv common unit concern both indicate according.,2023-08-03 02:40:02,0c951c86-5b0e-46de-9ead-fe5b19ec2ff3,c53f8889-4c5c-4db2-aae2-c280f77a5ad9
