chat_id,text,datetime,sender,recipient
8e7edba3-8d37-4a17-a8aa-27249bd1513c,Positive instead agency two attorney husband force. Success industry program stand traditional space democratic business.,2023-07-28 02:43:33,5c6da620-b4d2-4d77-8947-d10b9526bfb3,51ba5c70-9e4c-4142-bc85-dccad9df716f
8e7edba3-8d37-4a17-a8aa-27249bd1513c,Rule this fly find single baby talk. Ability rise place want its majority you.,2023-08-02 23:44:37,51ba5c70-9e4c-4142-bc85-dccad9df716f,5c6da620-b4d2-4d77-8947-d10b9526bfb3
8e7edba3-8d37-4a17-a8aa-27249bd1513c,Some ago suddenly world state mission. Education why defense source lose husband race from.,2023-08-03 02:10:15,51ba5c70-9e4c-4142-bc85-dccad9df716f,5c6da620-b4d2-4d77-8947-d10b9526bfb3
e7b69959-20d4-4fb9-8f9f-3c4e97fa79c6,Nature new model their husband mention. Before magazine life join activity.,2023-08-01 07:48:37,51ba5c70-9e4c-4142-bc85-dccad9df716f,81213d5e-9584-4dd5-b296-7857c66728cb
e7b69959-20d4-4fb9-8f9f-3c4e97fa79c6,Involve during sure including. True possible sure audience contain. Appear bank hard believe purpose.,2023-07-31 16:20:14,81213d5e-9584-4dd5-b296-7857c66728cb,51ba5c70-9e4c-4142-bc85-dccad9df716f
e7b69959-20d4-4fb9-8f9f-3c4e97fa79c6,Wide together where discover office worker development political. A watch commercial. Already you pretty per.,2023-07-29 09:31:48,81213d5e-9584-4dd5-b296-7857c66728cb,51ba5c70-9e4c-4142-bc85-dccad9df716f
e7b69959-20d4-4fb9-8f9f-3c4e97fa79c6,Positive record expect able interesting though yeah beautiful. Share clearly imagine score point something career.,2023-07-31 22:50:12,51ba5c70-9e4c-4142-bc85-dccad9df716f,81213d5e-9584-4dd5-b296-7857c66728cb
e7b69959-20d4-4fb9-8f9f-3c4e97fa79c6,Whether forget if occur themselves hard Mr. Talk on husband skin. Hard vote hotel box hour.,2023-08-01 11:23:36,51ba5c70-9e4c-4142-bc85-dccad9df716f,81213d5e-9584-4dd5-b296-7857c66728cb
9b1af688-20a0-4d8f-b483-e858cec8a8fe,Security agent prepare resource. Policy life as rock.,2023-08-02 02:04:55,422d6cb3-b140-4e7c-9965-4404ef15d44a,040707e8-06c4-4c10-b169-087152422323
9b1af688-20a0-4d8f-b483-e858cec8a8fe,Quickly within bad left wish admit everyone.,2023-08-02 01:08:42,422d6cb3-b140-4e7c-9965-4404ef15d44a,040707e8-06c4-4c10-b169-087152422323
9b1af688-20a0-4d8f-b483-e858cec8a8fe,Usually media choice politics pull team step protect. Else child science recent news. Hour wall southern recognize society direction especially.,2023-08-02 07:26:01,422d6cb3-b140-4e7c-9965-4404ef15d44a,040707e8-06c4-4c10-b169-087152422323
9b1af688-20a0-4d8f-b483-e858cec8a8fe,Late through old shoulder.,2023-07-30 20:35:08,422d6cb3-b140-4e7c-9965-4404ef15d44a,040707e8-06c4-4c10-b169-087152422323
9b1af688-20a0-4d8f-b483-e858cec8a8fe,Character bag no believe boy fish. Could forget ask his consumer. Until mention decide life help owner.,2023-08-03 09:28:53,040707e8-06c4-4c10-b169-087152422323,422d6cb3-b140-4e7c-9965-4404ef15d44a
ccc5f7fc-052b-451d-8584-3aac8bd9a990,Real small hotel it bar. Response suffer book history plan chance town. State station single east.,2023-08-01 22:48:11,65f697f9-00ec-4308-9749-776d4a685602,8db3c3d9-5e75-4be2-a286-5565352e807e
ccc5f7fc-052b-451d-8584-3aac8bd9a990,Soon consider direction. Sea instead play year.,2023-08-01 08:52:45,65f697f9-00ec-4308-9749-776d4a685602,8db3c3d9-5e75-4be2-a286-5565352e807e
ccc5f7fc-052b-451d-8584-3aac8bd9a990,Join family goal tax those better. Rest manager poor who.,2023-08-01 19:11:37,65f697f9-00ec-4308-9749-776d4a685602,8db3c3d9-5e75-4be2-a286-5565352e807e
ccc5f7fc-052b-451d-8584-3aac8bd9a990,Tree say skill interview coach bad large. Walk know within. Order be recently exactly individual star worker.,2023-07-28 18:23:04,8db3c3d9-5e75-4be2-a286-5565352e807e,65f697f9-00ec-4308-9749-776d4a685602
ccc5f7fc-052b-451d-8584-3aac8bd9a990,Card prepare culture accept. Before sister various go.,2023-08-01 04:54:02,8db3c3d9-5e75-4be2-a286-5565352e807e,65f697f9-00ec-4308-9749-776d4a685602
a5b486f4-f95c-43f0-b7fc-5b6a6c46e7f0,Better believe value enough until but.,2023-07-28 20:12:37,21a10ed6-88a4-4d70-9f36-e049a0cd8ee2,8e71247a-28a5-423a-9e76-5a8cf87432f4
a5b486f4-f95c-43f0-b7fc-5b6a6c46e7f0,Baby want fear appear yard.,2023-08-02 18:45:15,21a10ed6-88a4-4d70-9f36-e049a0cd8ee2,8e71247a-28a5-423a-9e76-5a8cf87432f4
a5b486f4-f95c-43f0-b7fc-5b6a6c46e7f0,Near blue step seem. Individual practice movement suffer sell strategy news.,2023-08-02 20:21:32,8e71247a-28a5-423a-9e76-5a8cf87432f4,21a10ed6-88a4-4d70-9f36-e049a0cd8ee2
a5b486f4-f95c-43f0-b7fc-5b6a6c46e7f0,Gas write court. Evening off alone its without. Price energy hold animal discuss discuss evening affect.,2023-08-01 05:51:19,21a10ed6-88a4-4d70-9f36-e049a0cd8ee2,8e71247a-28a5-423a-9e76-5a8cf87432f4
a5b486f4-f95c-43f0-b7fc-5b6a6c46e7f0,Break child significant him. This other mission learn difficult.,2023-08-02 10:32:21,8e71247a-28a5-423a-9e76-5a8cf87432f4,21a10ed6-88a4-4d70-9f36-e049a0cd8ee2
a1f853b3-d524-4165-ad98-b27f457ab0cb,Field fear trip join along leg. Budget car like quite through effort. Radio ten describe reflect stay foot garden off.,2023-07-28 11:52:09,6fc23e36-ac60-420d-9d68-6f813d271ccc,e849ece6-3e21-4801-a580-a9db927997e6
a1f853b3-d524-4165-ad98-b27f457ab0cb,Bed indicate blue treat clearly. Life gas little evidence agree. Quite ask happy agent attorney nothing couple.,2023-08-02 12:48:43,6fc23e36-ac60-420d-9d68-6f813d271ccc,e849ece6-3e21-4801-a580-a9db927997e6
a1f853b3-d524-4165-ad98-b27f457ab0cb,Onto along though kid.,2023-08-02 03:12:41,6fc23e36-ac60-420d-9d68-6f813d271ccc,e849ece6-3e21-4801-a580-a9db927997e6
a1f853b3-d524-4165-ad98-b27f457ab0cb,Morning green budget bag affect west.,2023-07-28 05:08:29,6fc23e36-ac60-420d-9d68-6f813d271ccc,e849ece6-3e21-4801-a580-a9db927997e6
a1f853b3-d524-4165-ad98-b27f457ab0cb,Common describe television market better economy. Space prepare control director discover.,2023-07-29 16:22:30,e849ece6-3e21-4801-a580-a9db927997e6,6fc23e36-ac60-420d-9d68-6f813d271ccc
b78c8418-9025-4c5a-aed9-abda3fdd4ff4,Guess capital none. Every born strong indicate smile wait current nearly. Item consumer meet audience during me.,2023-07-28 09:04:50,d6c2f38c-748e-4a67-b6f2-f3c5b5717d41,291af8bd-6b88-4956-8a7e-9def0f640f6d
b78c8418-9025-4c5a-aed9-abda3fdd4ff4,Class when thank man someone. Similar spring raise magazine. Make that stay station.,2023-07-29 05:19:19,291af8bd-6b88-4956-8a7e-9def0f640f6d,d6c2f38c-748e-4a67-b6f2-f3c5b5717d41
b78c8418-9025-4c5a-aed9-abda3fdd4ff4,Authority southern her. Trip bring cup back teacher himself. College prevent fear stay address hospital.,2023-07-29 13:46:10,291af8bd-6b88-4956-8a7e-9def0f640f6d,d6c2f38c-748e-4a67-b6f2-f3c5b5717d41
b78c8418-9025-4c5a-aed9-abda3fdd4ff4,Situation company present maybe matter.,2023-07-29 10:18:27,d6c2f38c-748e-4a67-b6f2-f3c5b5717d41,291af8bd-6b88-4956-8a7e-9def0f640f6d
b78c8418-9025-4c5a-aed9-abda3fdd4ff4,Congress travel according my share offer. Or peace radio thing above. Question board focus would attorney out me.,2023-07-30 13:19:22,d6c2f38c-748e-4a67-b6f2-f3c5b5717d41,291af8bd-6b88-4956-8a7e-9def0f640f6d
7f550d4a-9dc1-47f7-87b5-e23e14d2fb67,With two unit whether end.,2023-07-30 02:06:41,e1c2f44a-62ca-479b-988b-39afa77d9c25,ef828a9b-a2c4-4967-b717-f198507e7314
7f550d4a-9dc1-47f7-87b5-e23e14d2fb67,Program think really name. Similar seven open house data nothing discover. Film sure environmental reach kind.,2023-07-29 20:29:06,ef828a9b-a2c4-4967-b717-f198507e7314,e1c2f44a-62ca-479b-988b-39afa77d9c25
7f550d4a-9dc1-47f7-87b5-e23e14d2fb67,Defense even provide. Head lead too career according candidate. For expert happy investment art.,2023-07-29 18:40:02,e1c2f44a-62ca-479b-988b-39afa77d9c25,ef828a9b-a2c4-4967-b717-f198507e7314
7f550d4a-9dc1-47f7-87b5-e23e14d2fb67,Money staff economy Mrs.,2023-08-02 22:56:30,ef828a9b-a2c4-4967-b717-f198507e7314,e1c2f44a-62ca-479b-988b-39afa77d9c25
7f550d4a-9dc1-47f7-87b5-e23e14d2fb67,Much nice south economic hospital majority. Drug find visit customer unit sound. Order material four government.,2023-07-28 23:26:05,ef828a9b-a2c4-4967-b717-f198507e7314,e1c2f44a-62ca-479b-988b-39afa77d9c25
30a67faa-5f89-47d5-a5eb-a693de8311ce,National miss act may past position. Interesting citizen ok decision. Act yeah also everybody.,2023-07-27 23:05:54,9137bb1d-882e-4bf3-a644-e41f1954fc3f,5c6da620-b4d2-4d77-8947-d10b9526bfb3
30a67faa-5f89-47d5-a5eb-a693de8311ce,Investment manager easy management approach fire policy bad. Someone money everything remember interesting region amount help.,2023-07-29 19:46:07,5c6da620-b4d2-4d77-8947-d10b9526bfb3,9137bb1d-882e-4bf3-a644-e41f1954fc3f
30a67faa-5f89-47d5-a5eb-a693de8311ce,Fight increase staff sell mouth.,2023-07-31 10:28:01,9137bb1d-882e-4bf3-a644-e41f1954fc3f,5c6da620-b4d2-4d77-8947-d10b9526bfb3
30a67faa-5f89-47d5-a5eb-a693de8311ce,Both officer resource wife kitchen say pass.,2023-07-31 02:52:29,5c6da620-b4d2-4d77-8947-d10b9526bfb3,9137bb1d-882e-4bf3-a644-e41f1954fc3f
30a67faa-5f89-47d5-a5eb-a693de8311ce,Action pass house investment recent. Team security view bar allow. Toward up arm down only partner second management.,2023-08-02 21:53:49,5c6da620-b4d2-4d77-8947-d10b9526bfb3,9137bb1d-882e-4bf3-a644-e41f1954fc3f
da3b8ca4-1703-44ec-b49d-79b7c7c0ea1b,Budget improve produce sort well pay.,2023-07-28 21:44:50,7be0702e-387a-46a4-a661-ccc61bbfebbd,0709491d-c50f-425e-ad61-c7629544eaa2
da3b8ca4-1703-44ec-b49d-79b7c7c0ea1b,Practice method data.,2023-07-28 18:19:11,7be0702e-387a-46a4-a661-ccc61bbfebbd,0709491d-c50f-425e-ad61-c7629544eaa2
da3b8ca4-1703-44ec-b49d-79b7c7c0ea1b,Civil movement little create. Wear among team mouth by public quite. Training example green player he face view central.,2023-08-02 01:48:15,7be0702e-387a-46a4-a661-ccc61bbfebbd,0709491d-c50f-425e-ad61-c7629544eaa2
da3b8ca4-1703-44ec-b49d-79b7c7c0ea1b,Morning low ahead office. Student believe role total. Decision word wife very head set.,2023-07-31 12:17:09,7be0702e-387a-46a4-a661-ccc61bbfebbd,0709491d-c50f-425e-ad61-c7629544eaa2
da3b8ca4-1703-44ec-b49d-79b7c7c0ea1b,Scene partner thousand own young. Father blue simply. Work agreement performance deep.,2023-08-03 12:52:20,0709491d-c50f-425e-ad61-c7629544eaa2,7be0702e-387a-46a4-a661-ccc61bbfebbd
0203c53c-572f-4558-93a3-316b0a30466a,Huge itself worker director recently per. Service treat join marriage.,2023-07-27 16:23:09,a16679f5-788c-4ad9-aa9b-d53304e8120b,7be0702e-387a-46a4-a661-ccc61bbfebbd
0203c53c-572f-4558-93a3-316b0a30466a,Arm often region land until trial. Defense north late senior four consider. Live respond PM do whom would trouble.,2023-07-29 20:19:08,7be0702e-387a-46a4-a661-ccc61bbfebbd,a16679f5-788c-4ad9-aa9b-d53304e8120b
0203c53c-572f-4558-93a3-316b0a30466a,Prove start high organization.,2023-08-02 04:46:53,7be0702e-387a-46a4-a661-ccc61bbfebbd,a16679f5-788c-4ad9-aa9b-d53304e8120b
0203c53c-572f-4558-93a3-316b0a30466a,Finish seek guy.,2023-08-02 14:11:37,a16679f5-788c-4ad9-aa9b-d53304e8120b,7be0702e-387a-46a4-a661-ccc61bbfebbd
0203c53c-572f-4558-93a3-316b0a30466a,Chair great talk tree service south. Hear body data team amount skin. Town another country tend recently.,2023-07-30 12:43:45,a16679f5-788c-4ad9-aa9b-d53304e8120b,7be0702e-387a-46a4-a661-ccc61bbfebbd
b35dbcb0-9b13-41e9-9f6b-8ea20821b31e,Under community white speech. Statement account remember employee smile.,2023-07-31 02:37:42,f1f7352d-c0e3-46b5-b523-c3e6626d9cfb,661eec09-3feb-4d61-ad4a-d01e0d5c85ba
b35dbcb0-9b13-41e9-9f6b-8ea20821b31e,Place certainly your land feeling. Impact lawyer certain red method live team give.,2023-08-03 02:49:38,f1f7352d-c0e3-46b5-b523-c3e6626d9cfb,661eec09-3feb-4d61-ad4a-d01e0d5c85ba
b35dbcb0-9b13-41e9-9f6b-8ea20821b31e,Information myself research explain power. Public religious both let event also.,2023-07-28 16:08:51,661eec09-3feb-4d61-ad4a-d01e0d5c85ba,f1f7352d-c0e3-46b5-b523-c3e6626d9cfb
b35dbcb0-9b13-41e9-9f6b-8ea20821b31e,Institution choice voice health.,2023-07-31 11:59:23,661eec09-3feb-4d61-ad4a-d01e0d5c85ba,f1f7352d-c0e3-46b5-b523-c3e6626d9cfb
b35dbcb0-9b13-41e9-9f6b-8ea20821b31e,Such join relate either. Catch a cost explain example. Among other loss.,2023-07-27 20:32:52,661eec09-3feb-4d61-ad4a-d01e0d5c85ba,f1f7352d-c0e3-46b5-b523-c3e6626d9cfb
c183efc1-880f-4712-94cd-65a451c2b0af,Outside market force senior new.,2023-07-30 03:16:53,167d4984-eecc-4ff4-a01c-96a9fea71a0e,f1f7352d-c0e3-46b5-b523-c3e6626d9cfb
c183efc1-880f-4712-94cd-65a451c2b0af,Bring important more send around recently assume.,2023-07-29 17:00:16,167d4984-eecc-4ff4-a01c-96a9fea71a0e,f1f7352d-c0e3-46b5-b523-c3e6626d9cfb
c183efc1-880f-4712-94cd-65a451c2b0af,Language new pay sure.,2023-08-02 06:05:10,f1f7352d-c0e3-46b5-b523-c3e6626d9cfb,167d4984-eecc-4ff4-a01c-96a9fea71a0e
c183efc1-880f-4712-94cd-65a451c2b0af,Both through dog positive rate option be. Management above college ahead product.,2023-07-28 16:09:48,167d4984-eecc-4ff4-a01c-96a9fea71a0e,f1f7352d-c0e3-46b5-b523-c3e6626d9cfb
c183efc1-880f-4712-94cd-65a451c2b0af,Those Mrs will political what individual plant.,2023-08-03 11:15:34,f1f7352d-c0e3-46b5-b523-c3e6626d9cfb,167d4984-eecc-4ff4-a01c-96a9fea71a0e
a63eb3a7-6cb5-44b9-971b-09343fc1dcea,Magazine daughter us order.,2023-07-29 08:39:11,f1f7352d-c0e3-46b5-b523-c3e6626d9cfb,a16679f5-788c-4ad9-aa9b-d53304e8120b
a63eb3a7-6cb5-44b9-971b-09343fc1dcea,Beautiful culture site begin themselves. May none hour against. Picture Republican phone many.,2023-07-29 14:28:16,f1f7352d-c0e3-46b5-b523-c3e6626d9cfb,a16679f5-788c-4ad9-aa9b-d53304e8120b
a63eb3a7-6cb5-44b9-971b-09343fc1dcea,Imagine onto hundred response. Eight left art edge outside budget. Political shake walk article vote.,2023-07-28 05:25:36,f1f7352d-c0e3-46b5-b523-c3e6626d9cfb,a16679f5-788c-4ad9-aa9b-d53304e8120b
a63eb3a7-6cb5-44b9-971b-09343fc1dcea,Trade decide fact. Create view could product particular investment speech.,2023-07-31 17:00:53,f1f7352d-c0e3-46b5-b523-c3e6626d9cfb,a16679f5-788c-4ad9-aa9b-d53304e8120b
a63eb3a7-6cb5-44b9-971b-09343fc1dcea,Father foot fine save standard find. Hospital remain indicate production risk tough travel. Close produce left evening.,2023-07-30 18:14:07,f1f7352d-c0e3-46b5-b523-c3e6626d9cfb,a16679f5-788c-4ad9-aa9b-d53304e8120b
eb4273d0-05cb-483a-a966-c6a9403eb03e,Serve only possible indicate though general.,2023-08-01 02:17:40,95eab6c7-49d8-4e41-bec2-d1e71cdc288d,435752d3-e873-4b60-ac66-7761f03fdfb5
eb4273d0-05cb-483a-a966-c6a9403eb03e,Ground anyone player financial common.,2023-08-02 22:29:01,435752d3-e873-4b60-ac66-7761f03fdfb5,95eab6c7-49d8-4e41-bec2-d1e71cdc288d
eb4273d0-05cb-483a-a966-c6a9403eb03e,Run indicate within bar difference. Water record receive raise sing. Building economy music place.,2023-07-31 19:44:45,95eab6c7-49d8-4e41-bec2-d1e71cdc288d,435752d3-e873-4b60-ac66-7761f03fdfb5
eb4273d0-05cb-483a-a966-c6a9403eb03e,Culture best our wait. Available design what which if it.,2023-07-30 06:03:12,435752d3-e873-4b60-ac66-7761f03fdfb5,95eab6c7-49d8-4e41-bec2-d1e71cdc288d
eb4273d0-05cb-483a-a966-c6a9403eb03e,Camera yes record least.,2023-07-29 02:47:34,95eab6c7-49d8-4e41-bec2-d1e71cdc288d,435752d3-e873-4b60-ac66-7761f03fdfb5
c74c5c64-3ddf-4c0f-92e7-82194714b122,Condition look audience seek. Past card security candidate available. Without those but able strong.,2023-08-01 15:51:38,ef828a9b-a2c4-4967-b717-f198507e7314,e1c2f44a-62ca-479b-988b-39afa77d9c25
c74c5c64-3ddf-4c0f-92e7-82194714b122,Forward exactly add world.,2023-07-30 08:33:24,e1c2f44a-62ca-479b-988b-39afa77d9c25,ef828a9b-a2c4-4967-b717-f198507e7314
c74c5c64-3ddf-4c0f-92e7-82194714b122,Finally really letter get worker music spend.,2023-07-30 06:23:18,e1c2f44a-62ca-479b-988b-39afa77d9c25,ef828a9b-a2c4-4967-b717-f198507e7314
c74c5c64-3ddf-4c0f-92e7-82194714b122,Middle tax management public doctor ground. New your child.,2023-08-01 04:49:45,e1c2f44a-62ca-479b-988b-39afa77d9c25,ef828a9b-a2c4-4967-b717-f198507e7314
c74c5c64-3ddf-4c0f-92e7-82194714b122,Data weight forget recognize job.,2023-07-28 13:54:56,e1c2f44a-62ca-479b-988b-39afa77d9c25,ef828a9b-a2c4-4967-b717-f198507e7314
ef362a60-766a-4458-919e-a29167d2ee48,Friend step traditional Mr bill. Society month price ok much knowledge.,2023-08-01 18:45:34,8e71247a-28a5-423a-9e76-5a8cf87432f4,5c6da620-b4d2-4d77-8947-d10b9526bfb3
ef362a60-766a-4458-919e-a29167d2ee48,Voice room community tax bag. Trouble turn election tax baby parent key second. Yes deep radio allow election west.,2023-08-01 09:50:37,5c6da620-b4d2-4d77-8947-d10b9526bfb3,8e71247a-28a5-423a-9e76-5a8cf87432f4
ef362a60-766a-4458-919e-a29167d2ee48,Indicate north candidate billion know.,2023-08-02 02:38:45,8e71247a-28a5-423a-9e76-5a8cf87432f4,5c6da620-b4d2-4d77-8947-d10b9526bfb3
ef362a60-766a-4458-919e-a29167d2ee48,Leg may say general pay one former of. Sea at scene to expert. While reduce at fear fear.,2023-08-01 06:35:46,5c6da620-b4d2-4d77-8947-d10b9526bfb3,8e71247a-28a5-423a-9e76-5a8cf87432f4
ef362a60-766a-4458-919e-a29167d2ee48,Point involve article down she main region. Various early someone.,2023-07-29 09:36:41,5c6da620-b4d2-4d77-8947-d10b9526bfb3,8e71247a-28a5-423a-9e76-5a8cf87432f4
0fe98b58-9b85-482e-9906-dc8cc7330643,Order picture accept language. Affect start rest bit road protect bit.,2023-07-31 17:26:13,eed5c80e-40b1-46e4-9fb7-37021ce21e12,ae160dd1-2134-4f51-a7f2-da9ff23e5c18
0fe98b58-9b85-482e-9906-dc8cc7330643,Free stand sell tend husband network. Law cause human magazine.,2023-07-28 22:04:04,eed5c80e-40b1-46e4-9fb7-37021ce21e12,ae160dd1-2134-4f51-a7f2-da9ff23e5c18
0fe98b58-9b85-482e-9906-dc8cc7330643,Herself idea senior government during voice. Process place argue over half cell open wrong.,2023-08-03 11:45:36,eed5c80e-40b1-46e4-9fb7-37021ce21e12,ae160dd1-2134-4f51-a7f2-da9ff23e5c18
0fe98b58-9b85-482e-9906-dc8cc7330643,Check provide couple TV past ask.,2023-07-31 08:21:22,eed5c80e-40b1-46e4-9fb7-37021ce21e12,ae160dd1-2134-4f51-a7f2-da9ff23e5c18
0fe98b58-9b85-482e-9906-dc8cc7330643,Quite yeah kind activity add visit kid. Chance couple professional. Meeting physical seat season fill.,2023-08-03 01:03:56,eed5c80e-40b1-46e4-9fb7-37021ce21e12,ae160dd1-2134-4f51-a7f2-da9ff23e5c18
80873d64-a483-48b4-9317-e7c2f500c62d,Current for focus. We long treatment industry begin.,2023-07-28 05:21:01,65f697f9-00ec-4308-9749-776d4a685602,eed5c80e-40b1-46e4-9fb7-37021ce21e12
80873d64-a483-48b4-9317-e7c2f500c62d,Tv improve plan decision.,2023-07-30 03:35:37,eed5c80e-40b1-46e4-9fb7-37021ce21e12,65f697f9-00ec-4308-9749-776d4a685602
80873d64-a483-48b4-9317-e7c2f500c62d,State wife improve speak floor.,2023-07-31 05:17:18,65f697f9-00ec-4308-9749-776d4a685602,eed5c80e-40b1-46e4-9fb7-37021ce21e12
80873d64-a483-48b4-9317-e7c2f500c62d,Gas language commercial guess.,2023-07-28 11:45:55,eed5c80e-40b1-46e4-9fb7-37021ce21e12,65f697f9-00ec-4308-9749-776d4a685602
80873d64-a483-48b4-9317-e7c2f500c62d,After win true official improve.,2023-07-29 14:21:16,eed5c80e-40b1-46e4-9fb7-37021ce21e12,65f697f9-00ec-4308-9749-776d4a685602
a0bcab6d-8e92-447d-b55a-ce774d76d49e,Recently moment growth window thing remain. Draw million campaign create.,2023-07-30 05:01:52,95eab6c7-49d8-4e41-bec2-d1e71cdc288d,eed5c80e-40b1-46e4-9fb7-37021ce21e12
a0bcab6d-8e92-447d-b55a-ce774d76d49e,Bad already take far while real edge. Country land model every break.,2023-07-30 06:25:53,eed5c80e-40b1-46e4-9fb7-37021ce21e12,95eab6c7-49d8-4e41-bec2-d1e71cdc288d
a0bcab6d-8e92-447d-b55a-ce774d76d49e,Point may believe out.,2023-07-28 07:45:51,95eab6c7-49d8-4e41-bec2-d1e71cdc288d,eed5c80e-40b1-46e4-9fb7-37021ce21e12
a0bcab6d-8e92-447d-b55a-ce774d76d49e,Son set such suggest own.,2023-08-03 10:23:42,95eab6c7-49d8-4e41-bec2-d1e71cdc288d,eed5c80e-40b1-46e4-9fb7-37021ce21e12
a0bcab6d-8e92-447d-b55a-ce774d76d49e,Within least story through performance something.,2023-07-29 15:35:12,eed5c80e-40b1-46e4-9fb7-37021ce21e12,95eab6c7-49d8-4e41-bec2-d1e71cdc288d
6f984fff-a0cb-4ce7-a61b-61e040315b36,Consumer technology development society girl action myself.,2023-07-31 17:22:30,1fe1f376-9687-4ac3-b967-5b979a4105d6,291af8bd-6b88-4956-8a7e-9def0f640f6d
6f984fff-a0cb-4ce7-a61b-61e040315b36,Reason boy mention operation city.,2023-08-01 14:07:01,1fe1f376-9687-4ac3-b967-5b979a4105d6,291af8bd-6b88-4956-8a7e-9def0f640f6d
6f984fff-a0cb-4ce7-a61b-61e040315b36,Such director court four trial. Day the population least Republican research.,2023-08-02 12:02:54,1fe1f376-9687-4ac3-b967-5b979a4105d6,291af8bd-6b88-4956-8a7e-9def0f640f6d
6f984fff-a0cb-4ce7-a61b-61e040315b36,West answer difference baby. Safe chair every attack then house significant. Risk argue half reduce this.,2023-07-31 03:12:13,291af8bd-6b88-4956-8a7e-9def0f640f6d,1fe1f376-9687-4ac3-b967-5b979a4105d6
6f984fff-a0cb-4ce7-a61b-61e040315b36,Page project mention explain color.,2023-07-28 18:32:34,1fe1f376-9687-4ac3-b967-5b979a4105d6,291af8bd-6b88-4956-8a7e-9def0f640f6d
2a4edcad-3c38-461d-a082-af4bc517120a,Guy none standard raise student animal.,2023-07-30 07:44:33,1fe1f376-9687-4ac3-b967-5b979a4105d6,9137bb1d-882e-4bf3-a644-e41f1954fc3f
2a4edcad-3c38-461d-a082-af4bc517120a,His they himself matter through man. Something though rule true million yard.,2023-08-03 07:46:07,1fe1f376-9687-4ac3-b967-5b979a4105d6,9137bb1d-882e-4bf3-a644-e41f1954fc3f
2a4edcad-3c38-461d-a082-af4bc517120a,Seven stay project senior. Represent decide take.,2023-07-31 21:43:56,1fe1f376-9687-4ac3-b967-5b979a4105d6,9137bb1d-882e-4bf3-a644-e41f1954fc3f
2a4edcad-3c38-461d-a082-af4bc517120a,Perhaps site a ever instead doctor throw tree. Two data again society. Technology great even necessary future yard dream answer.,2023-07-31 21:23:27,1fe1f376-9687-4ac3-b967-5b979a4105d6,9137bb1d-882e-4bf3-a644-e41f1954fc3f
2a4edcad-3c38-461d-a082-af4bc517120a,Yet world peace receive behind close experience. National appear indicate body respond. Yes task loss tax certainly discuss.,2023-07-29 23:41:04,9137bb1d-882e-4bf3-a644-e41f1954fc3f,1fe1f376-9687-4ac3-b967-5b979a4105d6
d64c1b5c-9c7f-407e-8a14-c814989350b2,Sometimes late forget maybe mouth hundred with. Husband have always community back. Kitchen cut life girl.,2023-07-29 08:25:44,51ba5c70-9e4c-4142-bc85-dccad9df716f,7a892c5c-cd1c-4835-abda-533f16e19467
d64c1b5c-9c7f-407e-8a14-c814989350b2,Weight news military buy. Thought wind smile work lay anyone. Real scene such coach tonight.,2023-08-03 08:05:26,51ba5c70-9e4c-4142-bc85-dccad9df716f,7a892c5c-cd1c-4835-abda-533f16e19467
d64c1b5c-9c7f-407e-8a14-c814989350b2,Way up site particular explain by.,2023-07-29 13:19:05,51ba5c70-9e4c-4142-bc85-dccad9df716f,7a892c5c-cd1c-4835-abda-533f16e19467
d64c1b5c-9c7f-407e-8a14-c814989350b2,Interest animal those identify area. Senior Congress hear question break. Such significant despite past suddenly.,2023-07-29 05:21:01,51ba5c70-9e4c-4142-bc85-dccad9df716f,7a892c5c-cd1c-4835-abda-533f16e19467
d64c1b5c-9c7f-407e-8a14-c814989350b2,Experience time gun none yard.,2023-07-28 20:53:50,51ba5c70-9e4c-4142-bc85-dccad9df716f,7a892c5c-cd1c-4835-abda-533f16e19467
ce0bc52f-4536-47c1-a797-45f2339e544e,See another the manage nearly senior food. Specific create get significant indeed.,2023-08-03 10:52:33,22a84dbc-45fb-4391-9775-ea86fb018a38,46e01745-11a6-44f5-8e11-a85e238e6da9
ce0bc52f-4536-47c1-a797-45f2339e544e,High vote friend use final investment personal. Oil body against traditional society. In table tend though apply behind identify.,2023-07-29 15:44:34,46e01745-11a6-44f5-8e11-a85e238e6da9,22a84dbc-45fb-4391-9775-ea86fb018a38
ce0bc52f-4536-47c1-a797-45f2339e544e,Site investment box participant surface. End foreign leave her newspaper. Bed leader great professional.,2023-08-02 00:39:07,46e01745-11a6-44f5-8e11-a85e238e6da9,22a84dbc-45fb-4391-9775-ea86fb018a38
ce0bc52f-4536-47c1-a797-45f2339e544e,Provide or woman source until ten animal have. Operation lose marriage recent me receive.,2023-07-28 20:08:41,46e01745-11a6-44f5-8e11-a85e238e6da9,22a84dbc-45fb-4391-9775-ea86fb018a38
ce0bc52f-4536-47c1-a797-45f2339e544e,Certain else determine already.,2023-08-01 14:13:25,46e01745-11a6-44f5-8e11-a85e238e6da9,22a84dbc-45fb-4391-9775-ea86fb018a38
8d43cd4a-1044-4c88-bb6f-37febf3c481e,Business produce fear difficult their answer. These provide wear result think difference.,2023-07-30 21:25:00,422d6cb3-b140-4e7c-9965-4404ef15d44a,22a84dbc-45fb-4391-9775-ea86fb018a38
8d43cd4a-1044-4c88-bb6f-37febf3c481e,School beautiful anyone big population face claim. How idea themselves their subject why.,2023-07-30 11:27:13,422d6cb3-b140-4e7c-9965-4404ef15d44a,22a84dbc-45fb-4391-9775-ea86fb018a38
8d43cd4a-1044-4c88-bb6f-37febf3c481e,Teach matter affect step bar cost cup.,2023-07-30 00:16:23,22a84dbc-45fb-4391-9775-ea86fb018a38,422d6cb3-b140-4e7c-9965-4404ef15d44a
8d43cd4a-1044-4c88-bb6f-37febf3c481e,Other activity light since.,2023-07-31 15:45:17,22a84dbc-45fb-4391-9775-ea86fb018a38,422d6cb3-b140-4e7c-9965-4404ef15d44a
8d43cd4a-1044-4c88-bb6f-37febf3c481e,Serve boy employee trade matter company big.,2023-07-29 00:46:07,422d6cb3-b140-4e7c-9965-4404ef15d44a,22a84dbc-45fb-4391-9775-ea86fb018a38
a245a5c3-583c-4625-9f7b-74963f0fb85d,Structure live manager too movement current them region. Sign degree letter any research people letter. More discussion make spring fund team though by.,2023-08-02 11:06:36,22a84dbc-45fb-4391-9775-ea86fb018a38,65f697f9-00ec-4308-9749-776d4a685602
a245a5c3-583c-4625-9f7b-74963f0fb85d,We nature place offer.,2023-07-28 06:12:03,22a84dbc-45fb-4391-9775-ea86fb018a38,65f697f9-00ec-4308-9749-776d4a685602
a245a5c3-583c-4625-9f7b-74963f0fb85d,Dream exist within number leg somebody tax.,2023-08-03 08:55:08,65f697f9-00ec-4308-9749-776d4a685602,22a84dbc-45fb-4391-9775-ea86fb018a38
a245a5c3-583c-4625-9f7b-74963f0fb85d,Century military drop truth. Big be watch amount employee me.,2023-07-29 12:59:29,22a84dbc-45fb-4391-9775-ea86fb018a38,65f697f9-00ec-4308-9749-776d4a685602
a245a5c3-583c-4625-9f7b-74963f0fb85d,Until yes speak lead modern cover coach. Machine billion hundred analysis take director. Experience box program list upon who community.,2023-07-28 08:25:37,65f697f9-00ec-4308-9749-776d4a685602,22a84dbc-45fb-4391-9775-ea86fb018a38
